Kategori,Pesan,Cleaned
spam,Berkat isi ulang pulsa No Anda Terpilih sbg Pemenang kejutan tri Men-dpt cek TUNAI 100jt dr PLANET-3CARE PIN:b8337h9 cek hadiah anda di www.planet-3care2015.blogspot.com,berkat isi ulang pulsa no terpilih sbg pemenang kejutan tri mendpt cek tunai jt dr planetcare pinbh cek hadiah wwwplanetcareblogspotcom
spam,"Ass,maaf sy WAHYU.mengenai Mobil bpk yg mau di jual sy sudah lihat dan cocok, Untuk nego hrg silahkan Hub saudara sy di 081219550857 dgn pak JUSMAN SAFEI (TP)",assmaaf sy wahyumengenai mobil bpk yg jual sy lihat cocok nego hrg silahkan hub saudara sy dgn jusman safei tp
ham,"Iya  nama1, terakhir di lab jarkom. Pas copy sql SIGIndo tea.. ",iya nama lab jarkom pas copy sql sigindo tea
spam,Anda akan mengaktifkan Paket BBM Gratis berlaku 30 hari dari pertama kali aktivasi. Ketik FLASH (spasi) YA untuk melanjutkan,mengaktifkan paket bbm gratis berlaku kali aktivasi ketik flash spasi ya melanjutkan
ham,atulah aku teh udh ngidam sate maranggi dr bulan puasa 󾌹 naha ka subang teu ngajakan ih,atulah teh udh ngidam sate maranggi dr puasa 󾌹 naha ka subang teu ngajakan ih
spam,"BONUS Rp. 5,000 untuk kamu! Cukup kirim SMS 2X hari ini untuk mendapatkan bonusnya, khusus hari ini saja!  T483",bonus rp kirim sms x bonusnya khusus t
ham,"Hai akang-teteh, bagi kalian yang belum tau, merekalah calon Pemimpin KEMAKOM periode 2016-2017! yuk kita simak visi-misi mereka :)",hai akangteteh tau calon pemimpin kemakom periode yuk simak visimisi
spam,"quota 1,5 GB harga hanya mulai 32,5 ribu, beli paketnya di *100*1# Puas internetan selama 30 hari",quota gb harga ribu beli paketnya puas internetan
spam,MURAH! Hanya Rp25rb dptkan 2GB paket internetan utk 30hr. Kini internetan jadi semakin seru! Aktifkan segera di *550*904# promo s/d 29Feb16,murah rprb dptkan gb paket internetan utk hr internetan seru aktifkan promo sd feb
spam,Migrasikan kartu Anda ke kartuHalo (NOMOR TETAP SAMA). DAPATKAN Paket Spesial 4GB Hanya 25rb/bulan. kunjungi GraPARI & tunjukan SMS ini.(Promo Terbatas).SKB,migrasikan kartu kartuhalo nomor dapatkan paket spesial gb rbbulan kunjungi grapari tunjukan sms inipromo terbatasskb
ham,aku kira bukan besoook :'(,besoook
spam,"Dapatkan EXTRA kuota 2GB 4G LTE dan EXTRA nelpon hingga 100mnt/1hr dg beli paket FLASH mulai 1GB di MY TELKOMSEL APP. Buruan, cek  di tsel.me/mytsel1 S&K",dapatkan extra kuota gb g lte extra nelpon mnthr dg beli paket flash gb my telkomsel app buruan cek tselmemytsel sk
ham,"Untuk yg kontrak game prog (dan juga dwm): kita jadwalkan untuk ikut Gemastik. Ini kompetisi terbesar antar prodi ilkom/IF, dan kita punya peluang besar untuk bidang ini.",yg kontrak game prog dwm jadwalkan gemastik kompetisi terbesar prodi ilkomif peluang bidang
spam,"Pelanggan yth,saya mba muliani operator Tri. Telah menghubungi anda tapi tidak tersambung jadi informasi ini saya sampaikan lewat SMS sebelum hadiahnya jatuh tempo. Selamat nomor Tri anda menang undian dr pesta isi ulang pulsa,Pin pemenang (25b17h) segera hubungi kantor Tri jakarta. Tlp; 089660608887 info klik: www.3tricard.blogspot.com",pelanggan ythsaya mba muliani operator tri menghubungi tersambung informasi sms hadiahnya jatuh tempo selamat nomor tri menang undian dr pesta isi ulang pulsapin pemenang bh hubungi kantor tri jakarta tlp info klik wwwtricardblogspotcom
ham,nama1 mau pergi ga? Kalo engga aku mau ke kosan,nama pergi ga kalo engga kosan
ham,Aku mau bawa balon sm coklat min. Mau nitip?,bawa balon sm coklat min nitip
ham,Edan edan nama1 semoga menjadi keluarga samawa ,edan edan nama semoga keluarga samawa
ham,*ngsih bunga ato coklat min ,ngsih bunga ato coklat min
spam,NIKMATI INDOSAT SUPER 3G+ utk Internetan ckp 10rb/minggu dpt Kuota 225MB(50MB+Bonus 175MB jam 00-06)Kecepatan hgg3.6Mbps.tekan *123*4*1*1# syarat berlaku hub:100,nikmati indosat super g utk internetan ckp rbminggu dpt kuota mbmbbonus mb jam kecepatan hggmbpstekan syarat berlaku hub
ham,Min lg dmn? Mo ngambil sertifikat yg kompas hihu,min lg dmn mo ngambil sertifikat yg kompas hihu
ham,Numpang berteduh wkwk. Aku tak punya tempat tujuan~,numpang berteduh wkwk tujuan
ham,"yahh masih lama ya, urgent ini wkwk",yahh ya urgent wkwk
ham,nama1 mau hunting kosan bentar gmn? Kita mau ngerjain dmn kita?,nama hunting kosan bentar gmn ngerjain dmn
spam,"Plg yth, selamat nomor 3Care anda terpilih mendptkan Hadiah Cek tunai Rp.45jt dr program Undian 3care PIN:7711CA88 Info klik: www.tricare2016.jimdo.com",plg yth selamat nomor care terpilih mendptkan hadiah cek tunai rpjt dr program undian care pinca info klik wwwtricarejimdocom
ham,"bebas nama1, terus nanti kalau ada tgl libur, pajuin aja misal jadi kamis atau sabtu.",bebas nama tgl libur pajuin aja kamis sabtu
ham,"Okayyy, nanti siang jam 1an hehe. Ga kemana-mana hari ini?",okayyy siang jam an hehe ga kemanamana
ham,"soal ada multiple choice ada essay. Yg weka masuk ke essay, tapi ada juga file yang dikumpulkan.",multiple choice essay yg weka masuk essay file dikumpulkan
ham,"saya keluar kota sd jumat, senin tgl 12 pagi aja (jam 9), gabung sama gameprog.",kota sd jumat senin tgl pagi aja jam gabung gameprog
ham,Dimulai dari angka 0,angka
spam,"Nasabah Bank BRI Yth, Selamat Anda Mndptkan Cek Tunai Rp.27jt dari BANK RAKYAT INDONESIA Pin : (ijh76k79) u/Info klik dan Kunjungi :www.hadiahBRI.blogspot.com",nasabah bank bri yth selamat mndptkan cek tunai rpjt bank rakyat indonesia pin ijhk uinfo klik kunjungi wwwhadiahbriblogspotcom
spam,"Ass.sy SUGIYONO yg tempo hari mngenai mobil TOYOTANYA,sy brminat,cocok,tlong hub sodara sy dlu,untuk negosiasi harganya. A/N;ABDULLAH HP;081389909777",asssy sugiyono yg tempo mngenai mobil toyotanyasy brminatcocoktlong hub sodara sy dluuntuk negosiasi harganya anabdullah hp
spam,"Bpk/Ibu Yth, Pemilik No.08994150xxx PIN Undian:4881247 Resmi m-dptkan Rp.15jt Cs: 02199545139 atau Klik: 3care2016.com",bpkibu yth pemilik noxxx pin undian resmi mdptkan rpjt cs klik carecom
ham,"Pas dia ngomong gtu km langsung diem ya nuy, kikuk gtu pasti diomongin kek gtu",pas ngomong gtu km langsung diem ya nuy kikuk gtu diomongin kek gtu
spam,INFO RESMI kepada/bpk/ibu yang terhormat SELAMAT No ANDA Pemenang ke 2dari pesta isi ulang 3care. No PIN:25e477r di undi tadi malam pkl 22:30 di SCTV U/info hadiah anda klik Www.tricare16.blogspot.com,info resmi kepadabpkibu terhormat selamat no pemenang pesta isi ulang care no piner undi malam pkl sctv uinfo hadiah klik wwwtricareblogspotcom
ham,Bisa bu...buka jam 11 bu,bubuka jam bu
ham,Iya ih maksimalkan waktu sebulan ini wkwkwk pdhl aku aja yg mo pindah :(,iya ih maksimalkan sebulan wkwkwk pdhl aja yg mo pindah
ham,"besok jam berapaa? harus jadi ih, udah 2 kali skip 😂",besok jam berapaa ih udah kali skip 😂
spam,Slmt!! No anda Mendpt hadiah Rp. 75 juta. dari TELKOMSEL poin. Diundi tadi mlm Pukul 23:30.wib Di RCTI.Info Hub : 085377177138.IR. SERIANTO. Pengirim : *777,slmt no mendpt hadiah rp juta telkomsel poin diundi mlm wib rctiinfo hub ir serianto pengirim
ham,Mau naik gojek tapi ga ada driver kayanya :( padahal bawaan banyak :(,gojek ga driver kayanya bawaan
ham,Kalo ada daun pepaya mah bungkus daunnya pake pepaya put,kalo daun pepaya mah bungkus daunnya pake pepaya put
spam,pesan resmi DARI PT.PLANET 3CARD anda mendapatkan hadiah CEK TUNAI Senilai Rp.100jt jatuh ke pemenang (3) kode PIN:bg58757 silahkan CEK di: www.planet-3care2016.blogspot.com.,pesan resmi ptplanet card hadiah cek tunai senilai rpjt jatuh pemenang kode pinbg silahkan cek wwwplanetcareblogspotcom
spam,"Kak, kirimkan dulu pulsa25rb di no baruku ini 085377771822",kak kirimkan pulsarb no baruku
ham,Kalo engga belakang aqila ada 600/bulan gatau masih apa engga deh,kalo engga aqila gatau engga deh
spam,Rp30rb/bln utk 3 bln (hrg normal Rp59rb utk bln ke-4 dst) bisa NELPON & SMS SEPUASNYA ke IM3 plus kuota 3GB+10GB (4G).  Mau? Ketik YA ke 919 sd 05-Aug-16,rprbbln utk bln hrg normal rprb utk bln dst nelpon sms sepuasnya im plus kuota gbgb g ketik ya sd aug
spam,"YTH,MIitra Silahkan cek poin anda dan tukarkan ke admin kami dengan format PO.PIN kirim ke +62xxxxxxxxxx",ythmiitra silahkan cek poin tukarkan admin format popin kirim xxxxxxxxxx
spam,Dukung rehabilitasi & pengembangan potensi anak berkebutuhan khusus di YPAC Jakarta. Mari berbagi melalui SMS Donasi dengan mengetik *123*65#,dukung rehabilitasi pengembangan potensi anak berkebutuhan khusus ypac jakarta mari berbagi sms donasi mengetik
spam,Beli 2 Gratis 1 atau beli 1 Diskon 25% tiket Kampung Gajah Wonderland Bandung s.d 31 Mei 2013. Tunjukkan SMS kpd Petugas .Info: www.indosat.com/kampunggajah,beli gratis beli diskon tiket kampung gajah wonderland bandung sd mei tunjukkan sms kpd petugas info wwwindosatcomkampunggajah
spam,"Ayam (sayap/paha bawah), Nasi, Perkedel Rp. 19.545. GRATIS Teh Pucuk. Tukar SMS ini di CFC HASAN SADIKIN hari ini. Selama Persediaan msh ada. Promo *606#",ayam sayappaha nasi perkedel rp gratis teh pucuk tukar sms cfc hasan sadikin persediaan msh promo
spam,Info resmi pt.tri care pin pemenang (8jf2177)  Simcard anda resmi mendapatkan hadiah 1 unit toyota yaris dari no 08968594××××,info resmi pttri care pin pemenang jf simcard resmi hadiah unit toyota yaris no ××××
ham,wisudaan kan hari jumat,wisudaan jumat
ham,Besok aku kasihin softfilenya gpp?,besok kasihin softfilenya gpp
spam,selamat!anda mndptkan hadiah Cektunai Rp. 15jt dari INDOSAT pin_277fg49 U/info pengambilan hadiah.kunjungi website indosat www.gebyar-poinindosat.blogspot.com,selamatanda mndptkan hadiah cektunai rp jt indosat pinfg uinfo pengambilan hadiahkunjungi website indosat wwwgebyarpoinindosatblogspotcom
ham,"Ada teh dikpad, ini kontaknya ####",teh dikpad kontaknya
spam,Awal bulan saat nya anda eksis lebih lama! Internetan pake volume ultima 900MB/30hr. Hrga mulai Rp 35rb di *100*471#. Tarif&lokasi cek di tsel.me/FL,nya eksis internetan pake volume ultima mbhr hrga rp rb tariflokasi cek tselmefl
spam,RESMI TRI CARE Pin pemenang Anda_8JF2177 Medptkan 1/Unit TOYOTA YARIS U/Info Lanjut klik: www.gebyar3care.jimdo.com CS:021-80001234/089643122237,resmi tri care pin pemenang andajf medptkan unit toyota yaris uinfo klik wwwgebyarcarejimdocom cs
ham,Penggunaan terakhir anda adalah 35417.00 dan telah memenuhi pemakaian pulsa minimum. Masa aktif kartu anda diperpanjang selama 30 hari dan akan aktif sampai 04/10/2016,penggunaan memenuhi pemakaian pulsa minimum aktif kartu diperpanjang aktif
ham,Yah saya dikostan temen dil. Hihi,yah dikostan temen dil hihi
ham,"Saya menyimpulkan, kita debat diantara karena kita yg cupu ilmu nya, atau kemungkinan pertanggungjawaban pasca penelitian yg moal kepegang. Atau rasa sayang ortu di kampus yg pengen kita lulus cepat",menyimpulkan debat yg cupu ilmu nya pertanggungjawaban pasca penelitian yg moal kepegang sayang ortu kampus yg pengen lulus cepat
ham,Mau nitip ga saya lagi di gerlong.,nitip ga gerlong
ham,Aku jg blm berangkt wkwk,jg blm berangkt wkwk
spam,"Dapatkan Bonus SMS Kamu. Hanya dg kirim SMS, Kamu akan dapat Bonus Ratusan SMS ke semua operator. Pakai terus Indosat Ooredoo & raih kebebasan berkomunikasi",dapatkan bonus sms dg kirim sms bonus ratusan sms operator pakai indosat ooredoo raih kebebasan berkomunikasi
ham,nama1;Graha Desila kmr 14 Lt.2;Aqua;20000(kembalian),namagraha desila kmr ltaquakembalian
spam,INFO RESMI PT.TRI.3 SimCard anda Resmi M-dptkan Hadiah MOBIL MAZDA-2 KODE PIN: E2747MLB Info Hub: 08996913677 KLIK: www.inforesmi3care.com,info resmi pttri simcard resmi mdptkan hadiah mobil mazda kode pin emlb info hub klik wwwinforesmicarecom
spam,Transfer saja uangnya ke rek ini.mandiri.NO Rek: 152-00-1236312-9.a/n:DARMAN. klau sdah di Transfer SMS saja ke nmor ini Trima kasih,transfer uangnya rek inimandirino rek andarman klau sdah transfer sms nmor trima kasih
ham,nama1 di kosan gaaa? Mau numpang dooong,nama kosan gaaa numpang dooong
ham,Januari pokoknya mau sama sapapun kemanapun harus liburan fix aamiin,januari pokoknya sapapun kemanapun liburan fix aamiin
ham,Kantin fip nama1 sendiri td mau ke perpus. Tp bntar lg kan sholat ,kantin fip nama td perpus tp bntar lg sholat
ham,"Duh gusti disini ujan gede, semoga di riung gak bocor yah gais",duh gusti ujan gede semoga riung gak bocor yah gais
spam,"Selamat!! Anda Men’dpt hadiah Rp.75juta. Dari TELKOMSELpoin ""Periode maret"" PIN anda(33c7) Hub kntr pusat: 082113720777 Ir.Wardoyo).",selamat men’dpt hadiah rpjuta telkomselpoin periode maret pin andac hub kntr pusat irwardoyo
ham,Gais kalo dri upi ke unisba pake angkot apa pulang pergi? ,gais kalo dri upi unisba pake angkot pulang pergi
spam,"Selamat,Kepada pelanggan 08157xxx Anda mendpt hadiah ke4 Dalam program POIN PLUS PLUS INDOSAT No.PIN:277fg49 info klik www.poinplus-plus-7887-2013.webs.com",selamatkepada pelanggan xxx mendpt hadiah program poin plus plus indosat nopinfg info klik wwwpoinpluspluswebscom
spam,"MELEJIT PINTAR,kursus suami-isteri aktifasi smangat bljr&penguatan fungsi i=otak anak agar prestasi mningkat.Telepon 02749447574 atau ketik OK sms ke 081931753240",melejit pintarkursus suamiisteri aktifasi smangat bljrpenguatan fungsi iotak anak prestasi mningkattelepon ketik ok sms
ham,Gak takut kok. Tp emang blm mau. Gatau sampe kapan kwkw,gak takut tp emang blm gatau sampe kwkw
ham,"ooh iya klo controler, ku kira td modelnya.",ooh iya klo controler ku td modelnya
spam,Yth Bpk/Ibu. BNI menyatakan Rekening anda terpilih sebagai pemenang hadiah Rp. 35jt. kode cek anda 03299757 info klik www.bankbni2016.blogspot.com,yth bpkibu bni rekening terpilih pemenang hadiah rp jt kode cek info klik wwwbankbniblogspotcom
ham,Ko gtu ya parah bgt masa jam kerja ngeroko. Biar dapet inspirasi meren ya,ko gtu ya parah bgt jam kerja ngeroko biar dapet inspirasi meren ya
ham,Subuh jg abis maghrib itu teh ahaha,subuh jg abis maghrib teh ahaha
ham,"Terimakasih, saat ini Anda masih terdaftar sebagai pelanggan TCash.",terimakasih terdaftar pelanggan tcash
spam,"Jangan sampai kehabisan, HARI INI di Baskin Robbins Value Scoop cuma 35.000 lho! Tunjukkan SMS ini. S&K Berlaku. Promo *606#",kehabisan baskin robbins value scoop lho tunjukkan sms sk berlaku promo
spam,"PENAWARAN KHUSUS! BONUS KUOTA 500MB (1hr)! Cukup isi ulang min. 5,000 hari ini! Ayo buruan isi pulsa sekarang juga. T536",penawaran khusus bonus kuota mb hr isi ulang min ayo buruan isi pulsa t
ham,Mana duduk plg depan selalu kdg aku ga tau keadaan dblkg. Siapa yg hdr siapa yg engga. Wkwk,duduk plg kdg ga tau dblkg yg hdr yg engga wkwk
spam,"Di transfer saja Uang'nya ke rekening BNI ini, a/n. ISMAWATI. Rek: 0248147033. SMS saja klo sdh kirim.",transfer uangnya rekening bni an ismawati rek sms klo sdh kirim
spam,"Lebih hemat langganan paket Internet MINGGUAN dgn kuota 250MB Cuma Rp 10,000. Caranya gampang cukup ketik KUOTA (SPASI) 10K ke 363.",hemat langganan paket internet mingguan dgn kuota mb rp gampang ketik kuota spasi k
spam,"Selamat, Anda telah membeli Paket Combo Kenyang  Internet As. Cek bonus di *889#.",selamat membeli paket combo kenyang internet as cek bonus
ham,"numpang promo yah, siapa tau ada yang berminat 😊 bisa liat di instagram nya ",numpang promo yah tau berminat 😊 liat instagram nya
spam,"Lebih hemat langganan paket Data MINGGUAN. Cuma Rp10.900. Caranya? gampang kok, cukup ketik KUOTA(spasi)10K krm sms ke 363.",hemat langganan paket data mingguan rp gampang ketik kuotaspasik krm sms
spam,"PROMO: Beli paket Flash mulai 3,5GB di My Telkomsel App dpt extra paket 1GB midnight (00-09). Buruan, promo terbatas! S&K",promo beli paket flash gb my telkomsel app dpt extra paket gb midnight buruan promo terbatas sk
spam,Mau Uang Tunai 1jt?Ayo gabung layanan Video Cliponyu & Keluarkan jurus gombal-mu yg paling dahsyat utk host2 cantik Cliponyu. Ketik CLIP ke 99900.CS:02129657333,uang tunai jtayo gabung layanan video cliponyu keluarkan jurus gombalmu yg dahsyat utk host cantik cliponyu ketik clip cs
ham,Saya meminta maaf atas apa-apa yang telah saya perbuat. maaf dari lisan ini yang belum terjaga. maaf atas perilaku yang kurang baik. maaf atas segala kesalahan baik yang tersadari atau yang tidak saya sadari.,maaf apaapa perbuat maaf lisan terjaga maaf perilaku maaf kesalahan tersadari sadari
ham,Wid jgn plg sebelum ketemu aku. Aku brgkt jam 5 hehe,wid jgn plg ketemu brgkt jam hehe
spam,"Sayang belikn aq pulsa di nmr ini, 085215126428, nanti aq yg telp km, ini aq pake hp tmn, skrg yacc!",sayang belikn aq pulsa nmr aq yg telp km aq pake hp tmn skrg yacc
spam,maaf kami sudah menghubungi tpi tdk tersmbung No.anda resmi meraih hadiah ke-2 dri PT.MKIOS PIN;M248K81 cek pin anda di www.hadiahresmi-mkios29.blogspot.com,maaf menghubungi tpi tdk tersmbung noanda resmi meraih hadiah dri ptmkios pinmk cek pin wwwhadiahresmimkiosblogspotcom
spam,Nasabah BRI Yth. Norek anda terpilih sebagai pemenang UNDIAN BRI-2016 KODE PIN anda (ijh76k79) U\info HADIAH anda klik: www.undian2016bri.blogspot.co.id,nasabah bri yth norek terpilih pemenang undian bri kode pin ijhk uinfo hadiah klik wwwundianbriblogspotcoid
spam,"Sy Dr. Hj FATIMA sdh cocok mengenai Rumah dan Tanah Bpk/Ibu, tlg jgn ditawarkan lg ke yg lain. Soal Hrg negosiasi ke suami sy di 082375833300 Dr. H. HENDRA IRAWAN",sy dr hj fatima sdh cocok rumah tanah bpkibu tlg jgn ditawarkan lg yg hrg negosiasi suami sy dr h hendra irawan
spam,"Butuh Piknik?Ada nih liburan GRATIS ke Hongkong!Cara:Pake pulsa AXIS di HP Androidmu buat transaksi sebanyak2nya items Pokemon Go,BIGO,COC, dll!Info838 LD328",butuh piknikada nih liburan gratis hongkongcarapake pulsa axis hp androidmu transaksi sebanyaknya items pokemon gobigococ dllinfo ld
spam,"[PROMO] Beli paket Flash mulai 1GB di MY TELKOMSEL APP dpt EXTRA kuota 2GB 4G LTE dan EXTRA nelpon hingga 100mnt/1hr. Buruan, cek  di tsel.me/mytsel1 S&K",promo beli paket flash gb my telkomsel app dpt extra kuota gb g lte extra nelpon mnthr buruan cek tselmemytsel sk
spam,"Gebyar poin plus-plus INDOSAT Edisi 2013 priode ke'9, No PIN undian anda (d377hi8) Resmi meraih hadiah, utk info; www.gebyarINDOSATpoinplus.weebly.com",gebyar poin plusplus indosat edisi priode no pin undian dhi resmi meraih hadiah utk info wwwgebyarindosatpoinplusweeblycom
ham,Salam jepret karet gelang. Hihip,salam jepret karet gelang hihip
ham,Coba siapa yg lagi di prodi? Punten liatin jadwal sidang. Ada tulisan suruh kumpul jam brp gitu gak? Nuhun,coba yg prodi punten liatin jadwal sidang tulisan suruh kumpul jam brp gitu gak nuhun
ham,Jangan gitu kang.. Aku tersinggung.,gitu kang tersinggung
spam,"Selamat tambahan Flash Anda sudah aktif, berlaku s.d. 2016-08-07 23:59:59.",selamat tambahan flash aktif berlaku sd
ham,"Urang mah kayanya dah jumatan, tapi jam 2an. Mau ke pa lala dulu bentar.",urang mah kayanya dah jumatan jam an pa lala bentar
ham,Saya brsik masih cuti bati ke kantor har rabu,brsik cuti bati kantor har rabu
ham,Matikan services spt antivirus dll.,matikan services spt antivirus dll
spam,Paket Anda sudah di non-aktifkan atas permintaan Anda. Penggunaan Internet anda akan di kenakan Tariff Dasar Internet sesuai skema tariff kartu Anda. Hubungi *363# untuk aktifkan Paket Internet lainnya. Info lebih lanjut www.telkomsel.com,paket nonaktifkan permintaan penggunaan internet kenakan tariff dasar internet sesuai skema tariff kartu hubungi aktifkan paket internet info wwwtelkomselcom
ham,nama1 .. Saya masih di perjalanan.. Besok aja habis jumatan ketemu di kanto.. Web service nya juga sudah bisa di akses,nama perjalanan besok aja habis jumatan ketemu kanto web service nya akses
ham,Itu namanya ap nur? Tokopedi bukalapak lumayan laa complete walopun kw sejenis,namanya ap nur tokopedi bukalapak lumayan laa complete walopun kw sejenis
spam,Dapatkan saldo bermain sebesar Rp 125rb hanya dengan bayar Rp 75rb. Berlaku hari Senin-Kamis. Tukarkan SMS ini segera di Timezone terdekat! Promo *606#,dapatkan saldo bermain rp rb bayar rp rb berlaku seninkamis tukarkan sms timezone terdekat promo
spam,PESAN RESMI DR TRI CARE INDONESIA 2016 Selamat No.anda mendpatkn hadiah dgn No.PIN:47BL759 U/info silahkan kunjungi: www.gebyar3care-2016.jimdo.com,pesan resmi dr tri care indonesia selamat noanda mendpatkn hadiah dgn nopinbl uinfo silahkan kunjungi wwwgebyarcarejimdocom
spam,Slmt!! No Anda Men-dptkan Hadiah dr Pengundian Poin Plus Plus INDOSAT No Pin(d377hi8) info Pemenang silahkan klik www.kejutan-indosatpoinplusplus2013.webs.com,slmt no mendptkan hadiah dr pengundian poin plus plus indosat no pindhi info pemenang silahkan klik wwwkejutanindosatpoinpluspluswebscom
spam,Slmt no anda resmi m/dpt hdiah Rp100jt  DRI PT MKIOS pmenang ke2 pin anda[M2577] u/info;hub.pak.H RISAL DERMAWAN 0822-9399-7119 MKIOS,slmt no resmi mdpt hdiah rpjt dri pt mkios pmenang pin andam uinfohubpakh risal dermawan mkios
ham,Biasanya dia bukannya ke subang ya kalo weekend,subang ya kalo weekend
spam,plg yth no. Anda terpilih menang cek Rp.100jt dr PT.TELKOMSEL HUT TELKOMSEL Ke-17 thn 2012 hub call center:085313311113,plg yth no terpilih menang cek rpjt dr pttelkomsel hut telkomsel thn hub call center
ham,Aku di pt. DI,pt
ham,"nya sore we atuh gi, kalo mau pagi / siang weekend nya",nya sore we atuh gi kalo pagi siang weekend nya
spam,"Dapatkan voucher Cipika Rp 100rb utk belanja kuliner, gadget, fashion, dll. Tkn *123*45# pilih Cipika, GRATIS & terbatas. Info: www.indosatooredoo.com/12345",dapatkan voucher cipika rp rb utk belanja kuliner gadget fashion dll tkn pilih cipika gratis terbatas info wwwindosatooredoocom
ham,Eta mah data dokter keseluruhan. Maksud urg teh kan si pasien teh aya meren di pariksa ku dokter saha.,eta mah data dokter maksud urg teh si pasien teh aya meren pariksa ku dokter saha
ham,Oh oke Pak nanti saya lgsg kesana untuk kepastikan buka jam berapa? Ke bebek komar yg dekat dt bisa?,oh oke lgsg kesana kepastikan buka jam bebek komar yg dt
spam,"Maaf…! saya bu RATNA meganai RUMAH saya Sudah liat, soalnya saya lagi di bandara silahkan hubungi suami saya H. ARIF ISKANDAR,SE hp:081218844557 trims.",maaf… bu ratna meganai rumah liat bandara silahkan hubungi suami h arif iskandarse hp trims
ham,Mungkin aa nya tau kl wajah nama1 bakal beda sendiri pas gaya ini (up),aa nya tau kl wajah nama beda pas gaya up
spam,"Raih smartphone, diskon merchant & free internet, voice, SMS di Promo 71 Tahun RI dengan tukar 17 Telkomsel POIN mulai 15Ags16 hanya di MyTelkomsel Apps",raih smartphone diskon merchant free internet voice sms promo ri tukar telkomsel poin ags mytelkomsel apps
spam,"Tolong uangnya di transfer aja kesini MANDIRI a/n RAHMAD ADRIAN No rek: 1340-0065-58125 sms aja kalo sdh dikirim, trims",tolong uangnya transfer aja kesini mandiri an rahmad adrian no rek sms aja kalo sdh dikirim trims
ham,Doakan aja ya bsok lancar paling cepet aku nyampe sana jam 9 malem,doakan aja ya bsok lancar cepet nyampe jam malem
ham,Bagi yg tertarik lanjut ke gemastik 2016 ini tempat diskusinya : http://line.me/R/ti/g/xxxxx,yg tertarik gemastik diskusinya httplinemertigxxxxx
spam,"PAKET BRONET 24JAM 15MB 1hr sudah aktif. Nikmati 15MB berlaku di 00-23.59 aktif s.d 28-08-2016. Promo AXIS lainnya, telp *123#. Info838",paket bronet jam mb hr aktif nikmati mb berlaku aktif sd promo axis telp info
spam,Download dan rasakan serunya game-game premium pilihan hanya di *900#,download rasakan serunya gamegame premium pilihan
ham,Terima kasih atas konfirmasinya. Orderan sedang kami proses.,terima kasih konfirmasinya orderan proses
ham,Ada perasaan nyesel gt sedikit. Waktu kuliah. Asa ga merhatin. Ga ngerangkul semua. Aku pribadi hmm,perasaan nyesel gt kuliah asa ga merhatin ga ngerangkul pribadi hmm
spam,cuma Rp 7500 dapat nelpon dan SMS UNLIMITED ke sesama Indosat Ooredoo   internetan sepuasnya 3 hari dengan paket Ramadhan Unlimited. ketik *123*88#,rp nelpon sms unlimited indosat ooredoo internetan sepuasnya paket ramadhan unlimited ketik
spam,"Hai Apa Kabar? Ada Bonus Meriah Cukup isi pulsa minimun Rp 5 Ribu s.d 15 November, kamu langsung dapatkan 300 MB GRATIS. Ayo isi pulsa! Bonus utk 3 hari. RL044A",hai kabar bonus meriah isi pulsa minimun rp ribu sd november langsung dapatkan mb gratis ayo isi pulsa bonus utk rla
spam,Buktikan hematnya pakai argo tetap di Bandung dengan GrabCar hingga 20%. Hayu ajakan rerencangan sareng buktikeun nyalira!,buktikan hematnya pakai argo bandung grabcar hayu ajakan rerencangan sareng buktikeun nyalira
ham,Derr ya jangan wacana kaka bunda,derr ya wacana kaka bunda
ham,kamu kapan ke bandungg??,bandungg
spam,Rp29rb/bln utk 3 bln (hrg normal Rp59rb utk bln ke-4 dst) bisa NELPON & SMS SEPUASNYA ke IM3 plus kuota 1+1GB(4G)+10GB (4G).Mau? Ketik YA ke 919 sd 21 Juni 2016,rprbbln utk bln hrg normal rprb utk bln dst nelpon sms sepuasnya im plus kuota gbggb gmau ketik ya sd juni
ham,Kita yg stay di pdg aja mah tinggal cuss aja kapan meet up nya,yg stay pdg aja mah tinggal cuss aja meet up nya
ham,"supaya kita bisa mulai cepat, tolong posisi duduknya diatur dari awal, diberi jarak satu kolom kosong selang seling.",cepat tolong posisi duduknya diatur jarak kolom kosong selang seling
ham,"Guys, aku ganti template nya.",guys ganti template nya
spam,"TrmKsh Anda Tlh Berhasil Mengisi Pulsa SMARTFREN 10.000.Mau Jualan PULSA/BAYAR LISTRIK,SPEEDY/TELKOM Hub:Agen BAROKAH/Mp Reload.Pasti untung?",trmksh tlh berhasil mengisi pulsa smartfren jualan pulsabayar listrikspeedytelkom hubagen barokahmp reloadpasti untung
ham,E& (gila) ada namakuuu. Kapan aku luluuus,e gila namakuuu luluuus
ham,Iyalah makin malam makin mahal kek yg suka dijalanan,iyalah malam mahal kek yg suka dijalanan
spam,"Mau ekstra telpon, SMS, Internetan (S&K berlaku)? Ikuti surveu singkat tentang aplikasi musik s/d  3 September. Klik: http://tsel.me/mulu",ekstra telpon sms internetan sk berlaku ikuti surveu singkat aplikasi musik sd september klik httptselmemulu
ham,Gajadi gadiabsen yg telatnya lebib dr 15 menit da kayanya,gajadi gadiabsen yg telatnya lebib dr menit da kayanya
ham,Nanti aku push aja ya kuota modem lg hbs,push aja ya kuota modem lg hbs
spam,Selamat Paket BBM Gratis Anda telah diaktifkan. Paket BBM ini berlaku untuk 30 hari,selamat paket bbm gratis diaktifkan paket bbm berlaku
