Kategori,Pesan,Cleaned
spam,"Naik Lebih Sering, Hemat Lebih Banyak bersama GRAB!  Cukup lakukan 1 perjalanan biasa dengan GRABCAR atau GRABTAXI dan kamu akan OTOMATIS mendapatkan diskon di perjalanan berikutnya! Nikmati diskon bertahap hinga 35ribu/trip, ayo coba dan buktikan!",hemat grab lakukan perjalanan grabcar grabtaxi otomatis diskon perjalanan nikmati diskon bertahap hinga ributrip ayo coba buktikan
ham,Minta email github nya dong.,email github nya
ham,Kalo mau masak bawa bahannya dr rumah masing2 biar irit wkwk,kalo masak bawa bahannya dr rumah biar irit wkwk
ham,"Hbd nama1 , cepet sidang cepet wisuda yaaa aamiiiin",hbd nama cepet sidang cepet wisuda yaaa aamiiiin
spam,Maaf kami sdah menghubungi tpi tdak tersambung No.Anda resmi meraih hadiah ke-2 dari PT.M-KIOS pin;M248K81 u/info hadiah klik; www.hadiah-mkios17.blogspot.com,maaf sdah menghubungi tpi tdak tersambung noanda resmi meraih hadiah ptmkios pinmk uinfo hadiah klik wwwhadiahmkiosblogspotcom
ham,"ok,, kabarin yah, no m3 aku ke blokir, ga ada paket data, smsin aja ke asmul ya, ini kbtulan lagi free wife",ok kabarin yah no m blokir ga paket data smsin aja asmul ya kbtulan free wife
spam,Merdeka Hot Sale 45%! Kuota 5GB 30Hari(Rp125rb) CUMA Rp68rb penawaran terbatas! Cek SEKARANG di *111*1# .D966,merdeka hot sale kuota gb harirprb rprb penawaran terbatas cek d
spam,"PLENETCELL Cari agen U/jual pulsa All operator Harga pulsa, P5=4500 P10=8500 P20=17rb Untuk info ketik:INFO kirim ke: 085280948777 Atau Hhb CS: 082328823345",plenetcell cari agen ujual pulsa all operator harga pulsa p p prb info ketikinfo kirim hhb cs
spam,2.5 GB/30 hari hanya Rp 35 Ribu Spesial buat Anda yang terpilih. Aktifkan sekarang juga di *550*905#. Promo sd 30 Nov 2015.Buruan aktifkan sekarang. S&K,gb rp ribu spesial terpilih aktifkan promo sd nov buruan aktifkan sk
ham,Ka aku ga bisa liat kosannya skrg :( soalnya ngerjain uts take home ka ,ka ga liat kosannya skrg ngerjain uts take home ka
ham,"Selamat utk teman2 yg wisuda, semoga berkah ilmunya dan dilancarkan urusan kedepannya.. sukses terus buat kt semua :)",selamat utk teman yg wisuda semoga berkah ilmunya dilancarkan urusan kedepannya sukses kt
spam,Nasabah yth.rekning tbungn anda ERROR&hrus di monitor ulang agar bisa di gunakn kmbli.maaf sblum ke kntor hrap hub pk ARYADHI dlu di.0816288602.tks,nasabah ythrekning tbungn errorhrus monitor ulang gunakn kmblimaaf sblum kntor hrap hub pk aryadhi dlu ditks
ham,Gampang da cuma tampilan doang.,gampang da tampilan doang
ham,Traveloka.com: Your e-ticket summary 25-07-2016/15:30/XPRESS XN-738/PDG-BDO/DZZZZ Total: 1 passenger(s),travelokacom your eticket summary xpress xnpdgbdodzzzz total passengers
ham,Berarti saya ke palasari nya skrg .. abis itu langsung ke gik,palasari nya skrg abis langsung gik
spam,"Mau paket data Cuma 10ribuan? Buruan cek di *345#, penawaran ini hanya berlaku sebelum 1 Juli 2016",paket data ribuan buruan cek penawaran berlaku juli
spam,Ini rekeningnya mandiri : 900-00-1037951-0 a.n reza prasetya,rekeningnya mandiri an reza prasetya
ham,Kalo daftar doang tapi belum tentu jadi prasidang boleh ga?,kalo daftar doang prasidang ga
spam,"PROMO: Beli paket Flash mulai 1,3 GB di My Telkomsel App dpt EXTRA nelpon hingga 100mnt/1hr. Buruan, promo terbatas! S&K",promo beli paket flash gb my telkomsel app dpt extra nelpon mnthr buruan promo terbatas sk
spam,4.5GB/30 hari hanya Rp 55 Ribu Spesial buat anda yang terpilih. Aktifkan sekarang juga di *550*907# Buruan..! SKB,gb rp ribu spesial terpilih aktifkan buruan skb
ham,Kalau 13.5 itu untuk ayam kremes dan cabai ijo teh...kalau untuk bakar dan rica rica kita kasih 15rb deh   ...sudah pakai box dan air gelas,ayam kremes cabai ijo tehkalau bakar rica rica kasih rb deh pakai box air gelas
spam,"Dana Tunai (KTA) bunga 0,99% hingga 300 jt. Syarat KTP & CC.
Bisa Dgn BPKB rate 0.99% 3 hari CAIR . hub AYU 081584650877 (WA).mhn maaf bila menggangu",dana tunai kta bunga jt syarat ktp cc dgn bpkb rate cair hub ayu wamhn maaf menggangu
ham,Sundae min sirup kiwi pake cochochips :*,sundae min sirup kiwi pake cochochips
ham,Iyaaa makanan bumbu dsb juga biar bisa dibawa dr rumah supaya irit hehehe,iyaaa makanan bumbu dsb biar dibawa dr rumah irit hehehe
ham,Aku senin udah ke tempat kerja. Minggu2 depan aku gaktau bisa/ngga :(,senin udah kerja minggu gaktau bisangga
spam,Akhir bulan harus tetap eksis loh! Internetan pake volume ultima 900MB/30hr. Hrga mulai Rp 35rb di *100*471#. Tarif&lokasi cek di tsel.me/fl,eksis loh internetan pake volume ultima mbhr hrga rp rb tariflokasi cek tselmefl
ham,Boleh yang di depan ramen aa gpp jam 12.39 ya,ramen aa gpp jam ya
spam,Hari ini! BRONET 24Jam 3GB 60hr Rp31900 dan BRONETSpecial 6GB 60hr (3GB 24Jam+3GB 00-06) Rp34900 di *123*888# SEGERA aktifkan paketnya sekarang!! Info838 LD300,bronet jam gb hr rp bronetspecial gb hr gb jamgb rp aktifkan paketnya info ld
ham,"Ada nama1 . Tpi gatau msh berfungsi atau engga, udh lama ga dipake sih",nama tpi gatau msh berfungsi engga udh ga dipake sih
spam,INFO RESMI Tri Care SELAMAT Nomor Anda terpilih mendapatkan Hadiah 1 Unit MOBIL Dri Tri Care Dengan PIN Pemenang: br25h99 info: www.gebeyar-3care.tk,info resmi tri care selamat nomor terpilih hadiah unit mobil dri tri care pin pemenang brh info wwwgebeyarcaretk
spam,"sy RUDY dri MALAYSIA Brencana investasikan uang sy Sbagai bekal hidup di indo,sy butuh org yg bisa sy percayakan uang sy RM 5jt,bila Bsedia,sms di 085256144059",sy rudy dri malaysia brencana investasikan uang sy sbagai bekal hidup indosy butuh org yg sy percayakan uang sy rm jtbila bsediasms
ham,Ada yang 400 rb yang kamar mandinya sama2 kalau yang ada kamar mandi di dalam kalau yang kecil 600 dan yang agak besar 700 rb,rb kamar mandinya kamar mandi rb
spam,"Bella bingung bang mau nulis apa, daripada aq nulis panjang2 tapi serba salah, mending langsung ngobrol di tlpn aja deh bang ini no telp aq 0809-100-xxxx :)",bella bingung bang nulis aq nulis serba salah mending langsung ngobrol tlpn aja deh bang no telp aq xxxx
spam,Pakai handphone XL Axiata mu langsung bisa internetan pakai XL,pakai handphone xl axiata mu langsung internetan pakai xl
spam,"Jangan dikejar diskon berlari, beli RAWIT diskon datang sendiri.AYO isi ulang kartu AXIS kamu sekarang,dan pastikan besok ikutan promo Rabu RAWIT.Info838.LD279",dikejar diskon berlari beli rawit diskon sendiriayo isi ulang kartu axis sekarangdan pastikan besok ikutan promo rabu rawitinfold
spam,"Use my invite code, nxmvf722ue, and get a free ride up to Rp75,000. Redeem it at https://www.uber.com/invite/nxmvf722ue",use my invite code nxmvfue and get a free ride up to rp redeem it at httpswwwubercominvitenxmvfue
ham,"Belum diuji, pa. Insya Allah siang hari ini mau ke kampus, dan mudah2an pa eka nya ada.",diuji pa insya allah siang kampus mudahan pa eka nya
ham,"Jajaran kantin 79 kesana deket2 pengkolan pokoknya kang, ada tulisanya da",jajaran kantin kesana deket pengkolan pokoknya kang tulisanya da
spam,Mau Liburan Gratis ke Lombok Sambil Belajar Foto? Klik http://goo.gl/FVcnW .Paket Internet HANYA Rp1500 dpt 7MB/1hr. hub *100*15# .Cek status paket di *889# <<,liburan gratis lombok belajar foto klik httpgooglfvcnw paket internet rp dpt mbhr hub cek status paket
ham,Hub kita lg kalo udah dkt wktnya.,hub lg kalo udah dkt wktnya
spam,"Dapatkan BONUS PULSA hg 50rb jika isi ulang di hari Minggu, isi ulang mulai dr 10rb. Ktk: GRATIS krm ke 123. Panduan: ketik PAN krm ke123. Cek bonus tekan*555*3#",dapatkan bonus pulsa hg rb isi ulang minggu isi ulang dr rb ktk gratis krm panduan ketik pan krm cek bonus tekan
spam,"GRATIS 10GB! Bagi yg blm mengganti kartu SIM menjadi SIM 4G, tukarkan skrg di gerai IndosatOoredoo terdekat dan nikmati GRATIS 10GB di jaringan 4G.",gratis gb yg blm mengganti kartu sim sim g tukarkan skrg gerai indosatooredoo terdekat nikmati gratis gb jaringan g
ham,Kalau pertable emg lbh rapih laporan sih mad cuman bingung kalau pertable kdgkan ada yg dipake didr bbrp table gmn tuh mad?,pertable emg lbh rapih laporan sih mad cuman bingung pertable kdgkan yg dipake didr bbrp table gmn tuh mad
spam,Nasabah BANK BRI yth; No Rek Anda Mdpt hadiah Cek Rp. 27jt Dari BRI UNTUNG BELIUNG BRITAMA Pin Anda: (ijh76k79) Info klik di www.info,nasabah bank bri yth no rek mdpt hadiah cek rp jt bri untung beliung britama pin ijhk info klik wwwinfo
ham,Maaf bu kalau pesanannya bebek atau ayam ya,maaf bu pesanannya bebek ayam ya
spam,Yuks internetan seru-seruan dg Flash Volume Ultima kuota 1.8GB/30hr mulai dari Rp60rb sesuai zona lokasi. Hub *363*145#. Info tarif & lokasi lihat di tsel.me/FL,yuks internetan seruseruan dg flash volume ultima kuota gbhr rprb sesuai zona lokasi hub info tarif lokasi lihat tselmefl
spam,SIM Card anda M-dptkan HADIAH 1 YUNIT MOBIL TOYOTA YARIS No.pin pemenang Anda [8JF2177] U/INFO www.hadiahtricare.blogspot.com,sim card mdptkan hadiah yunit mobil toyota yaris nopin pemenang jf uinfo wwwhadiahtricareblogspotcom
spam,"Sy Ajeng mendapat sms dari PT. 3Care Indonesia uang tunai Rp. 100 juta di website www.pttricare2016.blogspot.com tetapi dimintai membayar Administrasi Rp. 1,250 juta...sy juga di telpon pak Bambang Purwanto & diberi nomer rekening tujuan pembayaran Administrasi melalui Bank BRI a/n PT. TRI LESTARI bahkan dalam websitenya dicantumkan KTP Marketing Office PT. 3 Care Indonesia",sy ajeng sms pt care indonesia uang tunai rp juta website wwwpttricareblogspotcom membayar administrasi rp jutasy telpon bambang purwanto nomer rekening tujuan pembayaran administrasi bank bri an pt tri lestari websitenya dicantumkan ktp marketing office pt care indonesia
ham,"Selamat sore teh, ini dg nama1 lg nyari kosan perbulan. Apakah ada yg kosong teh disana? Terima kasih.",selamat sore teh dg nama lg nyari kosan perbulan yg kosong teh disana terima kasih
spam,"Ribet bolak balik cek pulsa&cek sisa kuota internetmu? Download aja aplikasi myCare, hanya 1x klik semua jadi mudah. akses di https://mycare.indosatooredoo.com",ribet bolak cek pulsacek sisa kuota internetmu download aja aplikasi mycare x klik mudah akses httpsmycareindosatooredoocom
ham,sekalian liburannya ke malaysia juga wkwk,liburannya malaysia wkwk
spam,Pembayaran'nya bulan ini kalau mau di bayar harap telpon/sms dulu ke atasan kami Bpk.DEDY. Hp;085221118517.Terima kasih.,pembayarannya bayar harap telponsms atasan bpkdedy hpterima kasih
ham,22nya mad. Aku bingung bkn laporannya 😂,nya mad bingung bkn laporannya 😂
spam,"SLMT!! No Anda men-dpt hadiah dr:pengundian PT.TELKOMSEL No pin b89c7... Untuk melihat Hadiah Anda, silakan klik : www.telkomselpoin2222.webs.com",slmt no mendpt hadiah drpengundian pttelkomsel no pin bc hadiah silakan klik wwwtelkomselpoinwebscom
ham,Masih ngerasa bersalah ama kalian sebenernya,ngerasa bersalah ama sebenernya
spam,"Ya Allah, semoga yg mempunyai hp ini & keluarganya selalu dalam Kasih Sayang Mu, diberkahi rejekinya & dijauhkan dari mara bahaya"", jawab Amin jika Anda berkenan",ya allah semoga yg hp keluarganya kasih sayang mu diberkahi rejekinya dijauhkan mara bahaya amin berkenan
spam,Masih ingat dengan Warkop DKI ? Dapatkan NSP nya GRATIS dengan akses ke *600# dan dapatkan promo gratis lainnya sesuai dengan hobimu!,warkop dki dapatkan nsp nya gratis akses dapatkan promo gratis sesuai hobimu
spam,Daptkn e-TIKET pesawat PROMO melayani Domestik and internasional booking ONLINE cepat & aman hub: 085217845777/082310204777 Link www.citiling-travel.com,daptkn etiket pesawat promo melayani domestik and internasional booking online cepat aman hub link wwwcitilingtravelcom
spam,"SPESIAL utk kamu pelanggan setia Indosat Ooredoo. Bonus 14 hari masa aktif, 10 menit telp dan 100 SMS, CUMA isi ulang s/d 16 Desember 2015. (bonus berlaku 1x)",spesial utk pelanggan setia indosat ooredoo bonus aktif menit telp sms isi ulang sd desember bonus berlaku x
spam,"Loopers, PaketTelkomselFlash Rp.50000 utk 600 MB & tambahan 600 MB di 3G + 11 GB(00-12)(berlaku 30 hari) tlh diaktifkan. Paket otomatis diperpanjang pd akhir masa aktif jika kamu berlangganan paket ini",loopers pakettelkomselflash rp utk mb tambahan mb g gbberlaku tlh diaktifkan paket otomatis diperpanjang pd aktif berlangganan paket
ham,"wah repot kalo asumsinya gitu, kadang ada yg ganti kelompok. biasakan setiap dokumen itu ada nama, klau saya print lalu saya periksanya offline bingung kan mau dimasukkan ke mana kalau gak ada nama satupun.",repot kalo asumsinya gitu kadang yg ganti kelompok biasakan dokumen nama klau print periksanya offline bingung dimasukkan gak nama satupun
spam,Pangmeulikeun heula pulsa bpa anu simpati 20ribu we ke digantian ku bpa ieu nomor na nya 081356256931,pangmeulikeun heula pulsa bpa anu simpati ribu we digantian ku bpa ieu nomor na nya
spam,"Blackberry City Jual Blackberry Discond 40% Dakota 2,5jt Torch2 2,2jt Onyx3 2,1jt Davis 1,3jt Gemini 3G 1,1jt U/info Hub: Ibu.Anita 081315277257 PIN BB:29762D76",blackberry city jual blackberry discond dakota jt torch jt onyx jt davis jt gemini g jt uinfo hub ibuanita pin bbd
spam,"Gratis 120 menit Nelpon ke Sesama Indosat, 120 SMS ke Sesama Indosat&12 MB Internet slma 12 JAM tiap Isi Ulang 12 Rb.IsiUlang pulsamu 12Rb &Nikmati GRATISANnya",gratis menit nelpon indosat sms indosat mb internet slma jam isi ulang rbisiulang pulsamu rb nikmati gratisannya
spam,Internetan puas kapan aja buat kamu yang butuh kuota besar. Paket SUMO 30GB 30hari semua jaringan. Beli di *123*3*3#. Info 123. D956,internetan puas aja butuh kuota paket sumo gb jaringan beli info d
ham,Soalnya bapa mau liat database secara keseluruhan.,bapa liat database
spam,"Maaf' Soal Angsuran bulan ini Pembayaran harus melalui ke bpk.Yogi, HP: 08562115779, soalnya sdh dikuasakan",maaf angsuran pembayaran bpkyogi hp sdh dikuasakan
spam,Paket Flash anda 10 MB utk 1 hari akan berakhir pd 08/07/2016. Tarif non paket berlaku setelah tgl tsb. Info hubungi *363#. Cek Kuota *889#.,paket flash mb utk pd tarif non paket berlaku tgl tsb info hubungi cek kuota
spam,"Penawaran Spesial, Obral Paket Data 1.5 GB(00-24)+nelpon sepuasnya ke nmr Indosat hanya Rp20rb utk 1minggu.Daftar skrg ketik YA ke 929 berlaku hari ini RTX1",penawaran spesial obral paket data gbnelpon sepuasnya nmr indosat rprb utk minggudaftar skrg ketik ya berlaku rtx
spam,"Plg Yth,no Anda men-dpt hadiah dr: pengundiang PT. INDOSAT pin anda:b89c7h9 U/Melihat hadiah Anda klik: www.pemenangindosat-poin.webs.com",plg ythno mendpt hadiah dr pengundiang pt indosat pin andabch umelihat hadiah klik wwwpemenangindosatpoinwebscom
ham,nama1 ke pt. inti?,nama pt inti
ham,Paspor di perpanjang bayar nya brp nuy?,paspor perpanjang bayar nya brp nuy
spam,"SELAMAT, Anda memenangkan 1 UNIT MOBIL FREED dr TELKOMSEL, Edisi THN 2013 di undi tdi mlm pkl 23:30 di RCTI U/info Hub : 082329676767 H. MULYADI Pengirim : +777",selamat memenangkan unit mobil freed dr telkomsel edisi thn undi tdi mlm pkl rcti uinfo hub h mulyadi pengirim
spam,"Transfer ke Bank xxx saja a/n xxx No rek 7390685xxx, kalau sudah ditransfer SMS ke no ini ya!",transfer bank xxx an xxx no rek xxx ditransfer sms no ya
spam,"Flash Promo s.d 9 Agt! Ayo datangi Gallery Smartfren terdekat, DISKON 290rb dg tukar HP Smartfrenmu ke Andromax 4G LTE atau 190 utk tukar dg MiFi 4G LTE",flash promo sd agt ayo datangi gallery smartfren terdekat diskon rb dg tukar hp smartfrenmu andromax g lte utk tukar dg mifi g lte
spam,Gunakan TCASH untuk bayar tagihan listrik atau beli token listrik! Cukup hubungi *800# dan pilih menu pembayaran atau pembelian,tcash bayar tagihan listrik beli token listrik hubungi pilih menu pembayaran pembelian
ham,"bulan depan ada daging sapi, mau dibakar dmna ? d pantai atau d rumah nama1 ?",daging sapi dibakar dmna d pantai d rumah nama
spam,Ini nomor rekeningnya: 5829-01-012786-534. BRI a/n Andika Septiana.,nomor rekeningnya bri an andika septiana
spam,"Ma"" belikan dulu besok pulsa 20rbu di no baruku ini 085340781778 penting",ma belikan besok pulsa rbu no baruku
spam,Selamat Paket 50 SMS ke semua operator Anda telah aktif. Cek kuota di *888#,selamat paket sms operator aktif cek kuota
spam,Mau Nissan Juke?Ayo beli POPMIE skrg dan kirim kodenya di *200*200*Kodeuniq# siapa tahu kamu pemenangnya.Hati2 penipuan CS:02171790989 klik http://goo.gl/dm7PK,nissan jukeayo beli popmie skrg kirim kodenya kodeuniq pemenangnyahati penipuan cs klik httpgoogldmpk
spam,PESAN RESMI Selamat No Simcard Anda M-dptkan Hadiah Cek Rp.100juta dr TRI CARE Pin: 7Y7R8K9Z Info Kelik:www.situstricare77.blogspot.com,pesan resmi selamat no simcard mdptkan hadiah cek rpjuta dr tri care pin yrkz info kelikwwwsitustricareblogspotcom
spam,"PESAN RESMI dri TRI CARE Selamat anda m-dptkan hadiah CEK TUNAI Sebesar Rp.45jt Pin undian 94AD653, U/Info kunjungi;www.undian-bimatri.blogspot.com",pesan resmi dri tri care selamat mdptkan hadiah cek tunai rpjt pin undian ad uinfo kunjungiwwwundianbimatriblogspotcom
ham,"Udah di beres2in, tp lampu depannya ada yg mati kl gasalah",udah beresin tp lampu depannya yg mati kl gasalah
spam,Terima kasih telah menjadi Sahabat IndosatOoredoo. Mau tahu RAHASIA2 TERHEBOH ARTIS-ARTIS TOP + bonus gratis nelpon 60 menit?Tlp *700*1#,terima kasih sahabat indosatooredoo rahasia terheboh artisartis top bonus gratis nelpon menittlp
ham,Ayam kita menunya banyak bu...ada ayam bakar.kremes. cabe ijo. Lada hitam. Asam manis. Rica rica. Baberque. Untuk isinya nasi.ayam.lalapan.sambal. tempe tahu . air mineral gelas. Bu...maaf bu kita ada paket yang 16rb s/d 19rb. Kalau boleh tau anggaran ibu berapa ya,ayam menunya buada ayam bakarkremes cabe ijo lada hitam asam manis rica rica baberque isinya nasiayamlalapansambal tempe air mineral gelas bumaaf bu paket rb sd rb tau anggaran ya
spam,ANDA MAU MENANG TOGEL 100% Tembus pasang shio 7 tunggal angka 07.31.19.43....ingat maharnya pulsa 100rb dikirim ke no 0823...xxx khusus putaran SGP SENIN,menang togel tembus pasang shio tunggal angka maharnya pulsa rb dikirim no xxx khusus putaran sgp senin
ham,"Kumpulnya makan daging, jadi gak usah ke resto :D",kumpulnya makan daging gak resto d
ham,Tp berapa lama lagi ya Pak?,tp ya
spam,"ini nomor baru papa, tolong kirimin pulsa 50.000 ke nomor baru papa 085687329010. Papa lagi di kantor polisi, ada masalah. Jangan telepon Papa.",nomor papa tolong kirimin pulsa nomor papa papa kantor polisi telepon papa
spam,Hi Trims kmu udh gabung layanan Bung Gita Bicara Bola!Dpt info menarik n Prediksi Akurat dr Bung Gita! 3info/mg 2rb/sms.Stop: unreg Gita ke 3450.CS:0215649770,hi trims kmu udh gabung layanan gita bicara boladpt info menarik n prediksi akurat dr gita infomg rbsmsstop unreg gita cs
spam,Dapatkan Disc.30% utk Dominos PAN PIZZA!Roti yg lebih tebal dgn keju terasa sampai pinggir!Mulai Rp45500.Kunjungi toko terdekat/telf 1500366/Klik panpizza.co.id,dapatkan disc utk dominos pan pizzaroti yg tebal dgn keju pinggirmulai rpkunjungi toko terdekattelf klik panpizzacoid
ham,"nama1  titip pesan, jumat pagi kita kumpul trus bapa minta tolong ke kita buat bareng2 bujuk nama1 kuliah lagi",nama titip pesan jumat pagi kumpul trus bapa tolong bareng bujuk nama kuliah
ham,Asal pagi pagi ya.. Bjam 10an saya sudah ke jakarta..,pagi pagi ya bjam an jakarta
ham,"Aku jg waktu itu foto tgl 17 juli, katanya selesai 29 agustus :(",jg foto tgl juli selesai agustus
spam,"BIG SALE !!! DISCOUND 40% Z10-4,4jt IPHONE 5 32GB-3,7jt S.NOTE 2-3,8jt CAMERA, LAPTOP dll PIN BB 28AB8391 Call/sms: 0897-9844-777 Kunjungi www.indracell.com",big sale discound zjt iphone gbjt snote jt camera laptop dll pin bb ab callsms kunjungi wwwindracellcom
ham,Sekalian aku mau nanya alur dari rawat inap ke lab sama radiologi. Kalau obat kan ga ada yang ngolah.,nanya alur rawat inap lab radiologi obat ga ngolah
spam,"HARI TERAKHIR! Kunjungi Galeri Smartfren skrng, buat kamu Andromax A 4G jd 99rb (nrml 649rb). Tunggu apa lagi?!Stok terbatas.sd 22Agt.S&K.Info888.DL46J",kunjungi galeri smartfren skrng andromax a g jd rb nrml rb tunggu lagistok terbatassd agtskinfodlj
ham,Diagnosa mana? Di pasien_irj ga ada diagnosa,diagnosa pasienirj ga diagnosa
ham,Saat2 terbaik mencari pasangan tuh pas kuliah bukan sih?  Apa enak ditempat kerja? ,terbaik mencari pasangan tuh pas kuliah sih enak ditempat kerja
spam,"MEGA CELL Cari agen pulsa 1 Cip ke semua Operator Harga : V.5 = 4000 V.10 =8000 V.20 =16rb, dll Berminat ketik INFO kirim ke :085352444400",mega cell cari agen pulsa cip operator harga v v v rb dll berminat ketik info kirim
ham,"Guys, untuk groupwherenya pake github aja ya ",guys groupwherenya pake github aja ya
spam,"GRATIS PULSA hingga 250rb selama 7Hari 7Malam CUMA dg isi ulang mulai 10rb. Daftar SEGERA, ketik: GRATIS krm ke123(Reg ckp 1kali)Info: ketik INFO krm ke 123",gratis pulsa rb malam dg isi ulang rb daftar ketik gratis krm kereg ckp kaliinfo ketik info krm
ham,Okeyyy malem aja ya bahas apa ajanya yg dibawa,okeyyy malem aja ya bahas ajanya yg dibawa
spam,"Seminar ke Denpasar Bali mewakili kemahasiswaan & kewirausahaan dapat biaya transport Rp 10 juta. Nomor Peserta 100/semnas/9997175/dikti/2011. Direktur Kemahasiswaan DIKTI Prof. Dr. Joko Purwanto, M.Si. Hubungi 081281108799 Wahyudin Zarkasi. No. referensi PTX:001/3591/0100/1572/503",seminar denpasar bali mewakili kemahasiswaan kewirausahaan biaya transport rp juta nomor peserta semnasdikti direktur kemahasiswaan dikti prof dr joko purwanto msi hubungi wahyudin zarkasi no referensi ptx
spam,Ini Rekeningnya. bank MANDIRI. a/n: ALI SYAMSUDIN. rek: 136-001-198-6939,rekeningnya bank mandiri an ali syamsudin rek
ham,Minggunya pengen ke lembang git seharian ngubek bandung :(,minggunya pengen lembang git seharian ngubek bandung
ham,"InsyaaAllah ikhlas mel, asa udah di bahas digrup kan, Trs yg responnya gt",insyaaallah ikhlas mel asa udah bahas digrup trs yg responnya gt
ham,Min kalo ada inpo kosan perbulan share ya 😆,min kalo inpo kosan perbulan share ya 😆
spam,Karena kamu pelanggan setia kamu bisa tukarkan hp smartfrenmu dg Andromax E 4G LTE hny 859rb(nrml 999rb). Segera ke Galeri Smartfren,pelanggan setia tukarkan hp smartfrenmu dg andromax e g lte hny rbnrml rb galeri smartfren
ham,kalo ngga besok ke kampus senin  nama1 ke kampus nya ,kalo ngga besok kampus senin nama kampus nya
spam,PT M-TRONIK Telah hubungi anda namun tdk tersambung no anda resmi meraih hadiah ke-2 pin 25e477r cek hadiah anda di www.hadiahmtronik-2016.tk,pt mtronik hubungi tdk tersambung no resmi meraih hadiah pin er cek hadiah wwwhadiahmtroniktk
ham,Semangat!! Aku jg nanti bunganya aku titipin ya. Eh mau bunga atau makanan wid?,semangat jg bunganya titipin ya eh bunga makanan wid
ham,Blm mad ntr sore td udh ktmu,blm mad ntr sore td udh ktmu
ham,Udah aa aa semua sih. Makan mah sama cewek2. Lupa ih mukanya dy aku gak bisa nginget wajah hahaha,udah aa aa sih makan mah cewek lupa ih mukanya dy gak nginget wajah hahaha
ham,Jadi kapan kita meet upnyaa nih temaan temaan?,meet upnyaa nih temaan temaan
spam,"Jika anda bermasalah dgn CC/KT@, stres dgn bunga, pelunasan disc s/d 75%. Hub: ATY 082134976289(wa)/087888869297. LEGAL",bermasalah dgn cckt stres dgn bunga pelunasan disc sd hub aty wa legal
ham,"Baik Pak, berarti nanti Kamis kami ke kantor lagi",kamis kantor
spam,"Ass, mengenai rumah dan tanah yg kemarin, sy sdah survei, sy mrasa cocok, untuk nego harga hubungi atau sms suami saya, pak. haji. dermawan; 085796022225.",ass rumah tanah yg kemarin sy sdah survei sy mrasa cocok nego harga hubungi sms suami haji dermawan
ham,Pak kalau seporsi berapa ya ?,seporsi ya
spam,"DISKON 30RIBU khusus pelanggan baru Grab di Bandung. Berlaku 3x: kode promo URANGBANDUNG. Tak usah repot jalanan macet dan susah parkir, Hayu ngeGrab we atuh!",diskon ribu khusus pelanggan grab bandung berlaku x kode promo urangbandung repot jalanan macet susah parkir hayu ngegrab we atuh
spam,"toko bursa cuci gudang diskon 60% BB DAKOTA ; 2,3 JT, TOCH ; 1,6 JT, GEMINI ; 1 JT, LAPTOP INFO : 085322222369 PIN BB : 2A6FB800E www.shopinbursabb.blogspot.com",toko bursa cuci gudang diskon bb dakota jt toch jt gemini jt laptop info pin bb afbe wwwshopinbursabbblogspotcom
spam,"tolong uangnya di kirim ke rekening ini aja,BRI, A/N: HASAN MAHMUD. REK: 3292-0101-9525-532. Sms aja klau sudah di kirim,makasih.",tolong uangnya kirim rekening ajabri an hasan mahmud rek sms aja klau kirimmakasih
spam,"Paket Internet BRONET 24 JAM 2GB, 60hr Kamu sudah aktif & otomatis diperpanjang 27-10-2016 jam 23:59. Info838",paket internet bronet jam gb hr aktif otomatis diperpanjang jam info
spam,Hari Senin saatnya Nonton Hemat hanya 25ribu di Cinema XXI dgn TCASH TAP! Dptkan stiker TCASH TAP di graPARI terdekat. Info tsel.me/tappromo,senin nonton hemat ribu cinema xxi dgn tcash tap dptkan stiker tcash tap grapari terdekat info tselmetappromo
ham,Ada nya instagram,nya instagram
ham,"pesan dari nama1 : Assalamu'alaikum wr.wb. Pak, Indonesia Android Kejar bekerjasama dengan Depilkom mau mengadakan pelatihan Android level intermediate, masih ada slot 2 orang lagi, syaratnya sudah pernah membuat app android dan ngebuild menggunakan Android Studio, barang kali di kelas Bapak ada yang berminat. Nuhun.o ya pelatihannya mulai hari sabtu besok, 2 April, setiap sabtu selama 7 pertemuan, bertempat di lab praktikum kita.",pesan nama assalamualaikum wrwb indonesia android kejar bekerjasama depilkom mengadakan pelatihan android level intermediate slot orang syaratnya app android ngebuild android studio barang kali kelas berminat nuhuno ya pelatihannya sabtu besok april sabtu pertemuan bertempat lab praktikum
spam,PESAN RESMI PT.3Care Indonesia Berkat isi Ulang No. Anda M-dptkan hadiah ke-3 Dengan kode PIN Anda (B8337H9) U/info hadiah klik; www.hadiah-pt3care34.blogspot.com,pesan resmi ptcare indonesia berkat isi ulang no mdptkan hadiah kode pin bh uinfo hadiah klik wwwhadiahptcareblogspotcom
spam,Selamat !!! Anda mndptkan cek tunai Rp.27jt dr PT.Bank Rakyat Indonesia pin anda:ijh76k79 u/info klik www.bri-untungbeliung.blogspot.com atau hub:021-3677-1839,selamat mndptkan cek tunai rpjt dr ptbank rakyat indonesia pin andaijhk uinfo klik wwwbriuntungbeliungblogspotcom hub
