Kategori,Pesan,Cleaned
spam,Plg Yth: Simcard anda mendptkan bonus poin plus-plus 555 dr:PT.INDOSAT pin anda:277fg49 u/info klik di www.indosat-555.blogspot.com atau Hub:021-3338-0074.,plg yth simcard mendptkan bonus poin plusplus drptindosat pin andafg uinfo klik wwwindosatblogspotcom hub
ham,Iya ih ko sedih sih gtau kapan lg ke bandung :(,iya ih ko sedih sih gtau lg bandung
ham,Kalau mau bikin model/controller mending per apa y?,bikin modelcontroller mending y
ham,Selamat nama1. Semoga selalu menempuh hidup yang bahagia dan selalu menyenangkan,selamat nama semoga menempuh hidup bahagia menyenangkan
spam,Tingkatkan nilai isi ulang Anda selanjutnya minimal Rp10ribu untuk bisa mendapatkan Paket MURAH PAS di *100*999#. Info 188.,tingkatkan nilai isi ulang minimal rpribu paket murah pas info
spam,Uangnya di Trnsfer di BNI ini aja a/n RASTINA NO.REK.0253 7915 37.Klo sdh d Trnsfer Sms aja di no ini 085293355598 Trmks.,uangnya trnsfer bni aja an rastina norek klo sdh d trnsfer sms aja no trmks
spam,PESAN RESMI Selamat NO Simcard anda M-dptkam hadiah cek.Rp.35juta dr TRI CARE pin:7Y7R8K9Z info keik: www.id-tricare2016.blogspot.com,pesan resmi selamat no simcard mdptkam hadiah cekrpjuta dr tri care pinyrkz info keik wwwidtricareblogspotcom
spam,"Sy RUDI di jambi, bgi tman2 yg sering kalah Togel saatnya kalahkan bandar hub mbah ROS 082325557768 di jamin tembus, sy sdh buktikan 4D 50jt.",sy rudi jambi bgi tman yg kalah togel kalahkan bandar hub mbah ros jamin tembus sy sdh buktikan d jt
spam,Tri berBAGI bonus PULSA di bulan pernuh berkah! Isi pulsa min. 5rb dapet bonus pulsa 10rb utk nelp ke nmr Tri! Hanya hari ini saja! Ayo buruan isi pulsa! T496,tri berbagi bonus pulsa pernuh berkah isi pulsa min rb dapet bonus pulsa rb utk nelp nmr tri ayo buruan isi pulsa t
ham,silahkan berkas dambil di ruang saya,silahkan berkas dambil ruang
spam,"Mengenai Uang kontrakan kalau Masih Mau Di terusin Harap ke bpk, Suyono, Nomor Hp: 082127377377, Soalnya shd sya kuasakan Penuh ke dia, Maaf Cuma sms",uang kontrakan terusin harap bpk suyono nomor hp shd sya kuasakan penuh maaf sms
ham,Selamat ulang tahun semoga panjang umur dan sehat selalu,selamat ulang semoga umur sehat
spam,Surat Keputusan dari Tri Care Indonesia No.XV/2015 Pin_Pemenang ANDA : 67ytg44 mendapatkan hadiah cek tunai Rp 45 jt. U/INFO kunjungi: www.id.tri.webnode.com.,surat keputusan tri care indonesia noxv pinpemenang ytg hadiah cek tunai rp jt uinfo kunjungi wwwidtriwebnodecom
ham,Kartu SIM Anda telah berhasil diganti. Terima kasih,kartu sim berhasil diganti terima kasih
ham,"nama1 dmna ? boleh mnta tolong ss dong bisns proses nya,,,,,",nama dmna mnta tolong ss bisns proses nya
ham,Terimakasih. Paket 60 mb Anda telah aktif. Cek bonus *889#. Katalog Poin lengkap tsel.me/telkomselpoin. S&K berlaku,terimakasih paket mb aktif cek bonus katalog poin lengkap tselmetelkomselpoin sk berlaku
spam,"Kami dr Ktr INDOSAT sdh hub nmr anda tp tdk trsambung,jd kami krm SMS bhw no anda mendpt mobil JAGUAR PIN;d377hi8 info www.kejutanindosat-plusplus.weebly.com",dr ktr indosat sdh hub nmr tp tdk trsambungjd krm sms bhw no mendpt mobil jaguar pindhi info wwwkejutanindosatplusplusweeblycom
spam,PESAN RESMI Selamat No Simcard Anda M-dptkan Hadiah Cek Rp.100juta dr TRI CARE Pin: 7Y7R8K9Z Info Kelik: www.gebyar3care15.blogspot.com,pesan resmi selamat no simcard mdptkan hadiah cek rpjuta dr tri care pin yrkz info kelik wwwgebyarcareblogspotcom
ham,.sambl nunggu itu.. Gimana kalo ngerjain form formnya aja dulu,sambl nunggu gimana kalo ngerjain form formnya aja
spam,Pesta m-tronik Anda sebagai Pelanggan setia m-tronik terpilih sbgi pemenang ke[2] pin pemenang; [25e477r] u/info klik www.gebyarhadiah2016.com,pesta mtronik pelanggan setia mtronik terpilih sbgi pemenang pin pemenang er uinfo klik wwwgebyarhadiahcom
spam,"Selamat!! anda Mendpt hadiah Rp. 75 juta. Dari TELKOMSEL point ""Edisi september"" Hub kntr pusat",selamat mendpt hadiah rp juta telkomsel point edisi september hub kntr pusat
ham,Nomor OTP anda adalah [8874] -Telkomsel-,nomor otp telkomsel
ham,Aku mau nyari data yang dibutuhin dari tabel mana aja.,nyari data dibutuhin tabel aja
ham,Assalamualaikum Pak. Ini dg nama1 ilkom 2012. Maaf Pak td saya ninggalin proposal di meja Bapak di atas printer. Terima kasih Pak.,assalamualaikum dg nama ilkom maaf td ninggalin proposal meja printer terima kasih
ham,"Yooo sama2, oke nanti aku umumin di grup kelas",yooo oke umumin grup kelas
ham,"udah di benerin, kamu jangan sync dulu. backup filenya baru sync terus push dengan file kamu.",udah benerin sync backup filenya sync push file
ham,Ga ada birthday nya? Wkwk,ga birthday nya wkwk
spam,PROMO BLACKBERRY BB Dakota 2jt BB Torch 1.5jt BB Davis 1.3jt BB Orlando 1.8jt BB Gemini 950rb Berminat Hub : 085715186696 Promo terbatas,promo blackberry bb dakota jt bb torch jt bb davis jt bb orlando jt bb gemini rb berminat hub promo terbatas
ham,Jauh amat jemput di poskamling cilimus dee,jemput poskamling cilimus dee
ham,"[Akademik] Untuk perhatian tuk jadwal kontrak kuliah buat ang 2012 itu bukan sebenarny, kuliah ikut jadwal kur yg baru ang 2013 ato keatas 2014,2015,2016.. sehingga jadwal yg ada adalah jadwal bayangan tuk tujuan kontrak kuliah..Hal diatas ga berlaku tuk mk yg memang berjalan di ang kalian spt skripsi dan sidang..demikian harap diperhatikan..",akademik perhatian tuk jadwal kontrak kuliah ang sebenarny kuliah jadwal kur yg ang ato keatas jadwal yg jadwal bayangan tuk tujuan kontrak kuliahhal diatas ga berlaku tuk mk yg berjalan ang spt skripsi sidangdemikian harap diperhatikan
spam,"Pinjaman s/d 1 miliard jaminan bpkb mobil/truck min th 1998. Bunga 0,8%. Syarat mudah. Proses1hari  PT. Bunas Finance Tbk (cover all wilayah) ANDI 081330134449",pinjaman sd miliard jaminan bpkb mobiltruck min th bunga syarat mudah proseshari pt bunas finance tbk cover all wilayah andi
ham,Bu maaf saya lupa sekarang hari jumat ya...kalau jumat kita buka jam 1 bu...mau solat jumat dulu...maaf di dari upi ya,bu maaf lupa jumat yakalau jumat buka jam bumau solat jumat dulumaaf upi ya
spam,"PAKET BRONET 24JAM 2GB 60hr Rp28800 akan segera aktif. Temukan penawaran menarik AXIS lainnya, telp *123#.Info838",paket bronet jam gb hr rp aktif temukan penawaran menarik axis telp info
spam,Beli 6 Gratis 6 Donut dari DUNKIN DONUTS BORMA SETIABUDHI. Tukarkan SMS ini segera. Hanya berlaku untuk hari ini. Selama persediaan masih ada. Promo *606#,beli gratis donut dunkin donuts borma setiabudhi tukarkan sms berlaku persediaan promo
spam,"SMLT_Anda m-ndpt Hadiah TOYOTA ALL New AVANZA, dr TELKOMSELpoin, Pin pemenang anda b89c7h9. U/INFO Lebih lengkap kunjungi: http;//gebyartelkomsel.juplo.com",smltanda mndpt hadiah toyota all new avanza dr telkomselpoin pin pemenang bch uinfo lengkap kunjungi httpgebyartelkomseljuplocom
ham,"Ini hujan semalaman ruang tengah sama kamar kayanya gabisa di nyalain (:() harus nunggu kering baru bisa nyala, smg ujannya berenti 🙏",hujan semalaman ruang kamar kayanya gabisa nyalain nunggu kering nyala smg ujannya berenti 🙏
ham,"Nikah juga proses put, kadang diatas, kadang dibawah, gak selalu enak enak wkwkwkwk",nikah proses put kadang diatas kadang dibawah gak enak enak wkwkwkwk
spam,Ikuti JobFairActive & UjiKlyakanKerjaBerstifikat @PlasaTelkomMlg 9Feb13. dptkan platihan Intrview&Rekom kerja ke ribuan Ph. Info: www.indogetjob.com/085233334106,ikuti jobfairactive ujiklyakankerjaberstifikat plasatelkommlg feb dptkan platihan intrviewrekom kerja ribuan ph info wwwindogetjobcom
ham,Jam 8 berangkat aja gmn teh,jam berangkat aja gmn teh
spam,"ma, isi dl pulsa 20 rb di nmr ini 085337784732",ma isi dl pulsa rb nmr
ham,Kalo pake daging yg dah direbus enak gak dijadiin sate?,kalo pake daging yg dah direbus enak gak dijadiin sate
ham,"Pas sma gak pernah, tp kuliah disini org tua aku udah 2x pulang kampung",pas sma gak tp kuliah org tua udah x pulang kampung
spam,HOT PROMO! Dptkan EXTRA PULSA TSEL 50rb dg beli paket internet pertama kali di My Telkomsel App sjk 25 Agsts - 25 Sept. Cek detail paketnya di tsel.me/mytsel1,hot promo dptkan extra pulsa tsel rb dg beli paket internet kali my telkomsel app sjk agsts sept cek detail paketnya tselmemytsel
ham,Oke deh aku jg emang pengen ngumpul sih kapan lg :(,oke deh jg emang pengen ngumpul sih lg
spam,"GT-SHOP Disc.41% BB Z10 3jt BB Torch 2jt BB Davis 1jt Minat? Galaxy S4 3,5jt Cp.08994352577 Pin.25A1785B Gili-SMS versi Demo. Http://www/yusiwa.com",gtshop disc bb z jt bb torch jt bb davis jt minat galaxy s jt cp pinab gilisms versi demo httpwwwyusiwacom
ham,Jgn lupa malam ini jgn terlalu malam aja. Seadanya aja aku jg,jgn lupa malam jgn malam aja seadanya aja jg
ham,Pada ga aktif si tombol algoritma2 nya teh ga ngerti,ga aktif si tombol algoritma nya teh ga ngerti
ham,nama1 itu msh pake db aku yg lama itu msh anomali bisa nyesuain ga,nama msh pake db yg msh anomali nyesuain ga
ham,Gimana nuy menghadapi beliau?,gimana nuy menghadapi beliau
spam,Kami sdh mnghubungi tdk trsambung SIM CARD anda mendapatkan hadiah ketiga dri PT.AXIS pin [02399877] Klik  www.hadiah-ptaxis.blogspot.co.id,sdh mnghubungi tdk trsambung sim card hadiah ketiga dri ptaxis pin klik wwwhadiahptaxisblogspotcoid
spam,"Yang lain penuh batasan,kami beri kebebasa n. DOUBLE KUOTA BONUS 10GB(4G), UNLIMITED Nelp&SMS, Musik streaming gak pakai Kuota!cuma dg FREEDOM COMBO. Daftar*123#",penuh batasankami kebebasa n double kuota bonus gbg unlimited nelpsms musik streaming gak pakai kuotacuma dg freedom combo daftar
ham,Hmm sebenernya itu cuman eksekusi jquery di control sep. Coba cek jquery yg dicotroller waktu klik button. Kan ke controller yg buat nyetak pdf,hmm sebenernya cuman eksekusi jquery control sep coba cek jquery yg dicotroller klik button controller yg nyetak pdf
ham,Masak dikosan aku mau makan orek buatan kamu min,masak dikosan makan orek buatan min
ham,"Sama ingetin ya, ini kan web nya mau di publish, kita kan ikut develop tuh, nah di web nya ada nama kita atau jurusan ga?",ingetin ya web nya publish develop tuh web nya nama jurusan ga
ham,Mul snack satu lagi teteh kasih rafael ya,mul snack teteh kasih rafael ya
spam,"Yank tlong isi’in aku pulsa 10rb, di no ini,082189983017 nanti aq yg tlpn yacc!",yank tlong isi’in pulsa rb no aq yg tlpn yacc
spam,Paket Tsel Flash akan berakhir tgl 07/08/2016. Akan diperpanjang dg 10 MB utk 1 hari dengan harga 2500 dpt berubah sesuai lokasi anda .  Pastikan pulsa anda mencukupi. Utk berhenti berlangganan Ketik FLASH OFF ke 3636. Info detail tariff lihat di Tsel.me/internet ,paket tsel flash tgl diperpanjang dg mb utk harga dpt berubah sesuai lokasi pastikan pulsa mencukupi utk berhenti berlangganan ketik flash off info detail tariff lihat tselmeinternet
ham,"Struktur Data, PLA, Skripsi, dan Sidang",struktur data pla skripsi sidang
spam,"Transfer ke BNI aja, a/n SORAYA HARUM rek;0233-293-922 klo sdh kbrin di nmr ini ya!",transfer bni aja an soraya harum rek klo sdh kbrin nmr ya
spam,"Paket super Ngebut 3.5GB, 30hr, Rp25rb Anda sudah aktif. Nikmati 500MB di 12.00:24.00 & 3G di 00:00-12:00 di 3G. Diperpanjang pada 11-Mar-2013 jam 23:59. Info 817",paket super ngebut gb hr rprb aktif nikmati mb g g diperpanjang mar jam info
spam,"Mau jajan? Gak usah kemana-mana sob, jajan online aja, terutama buat kamu yang suka nge games, cek http://tsel.me/jajanonline",jajan gak kemanamana sob jajan online aja suka nge games cek httptselmejajanonline
ham,"Saya buat banyak seri untuk PG, oleh karena itu jangan terlalu berharap bisa lihat punya teman (mungkin ini penyebab nilai PG jeblok kemarin?), waktunya akan terbatas dan ruangannya kita pake yg besar.",seri pg berharap lihat teman penyebab nilai pg jeblok kemarin terbatas ruangannya pake yg
ham,"Baik Pak, bsk sekalian kami bawa form penilaian ya Pak, dan berkas lainnya.",bsk bawa form penilaian ya berkas
spam,"Ingin Tahu Angka Jitu! Yg Keluar Putaran Pada Hari ini 20/01/2013 Hubungi : 082-335555-454. mbah TOGEL semarang ""Jamin 100% Tembus"" Raja SHIO (Buka 24 Jam)",angka jitu yg putaran hubungi mbah togel semarang jamin tembus raja shio buka jam
spam,Isi ulang Pulsa Rp.5000 Regular oleh PUTERA SUKSES pada 11/02 19:57.Ref:78330280.GRATIS PULSA sd 250rb hg 7Hr 7Mlm.Ktk:GRATIS krm ke 123,isi ulang pulsa rp regular putera sukses refgratis pulsa sd rb hg hr mlmktkgratis krm
ham,Iya kan file terkahir itu data_pasien. -_-,iya file terkahir datapasien
spam,"plgn yth,saya h.rian harino opoerator tri tlah menghubungi anda tapi tidak tersambung jdi informasi ini saya sampaikan lwt sms,sblum hadiah jatuh tempo,selamat no tri anda menang undian dari 3care no pin pemenang anda MG75K7,segera hub kantor tri jakarta;0895-349-076-577/info klik www.kejutanundiantri.blogspot.com",plgn ythsaya hrian harino opoerator tri tlah menghubungi tersambung jdi informasi lwt smssblum hadiah jatuh temposelamat no tri menang undian care no pin pemenang mgksegera hub kantor tri jakartainfo klik wwwkejutanundiantriblogspotcom
ham,nama1 bisa pakai flash buat animasi ga?? Atau pakai movie maker??,nama pakai flash animasi ga pakai movie maker
ham,Ada diruangan nya tadi,diruangan nya
spam,Mau Pergi Dari Hatiku nya Aliando di HP kamu? Ambil NSP GRATIS nya dengan akses ke *600# dan dapatkan promo gratis lainnya sesuai hobimu!,pergi hatiku nya aliando hp ambil nsp gratis nya akses dapatkan promo gratis sesuai hobimu
ham,Kalo grup c1 aku jarang baca haha jd suka ketinggalan kabar berita,kalo grup c jarang baca haha jd suka ketinggalan kabar berita
ham,"Boleh bu, kalau ada yang bakal pindah bulan itu. Kalau tidak keberatan bisa kabarin Bu. Terima kasih.",bu pindah keberatan kabarin bu terima kasih
ham,Cukup alquran sbgai pedoman bagi org2 yg beriman.,alquran sbgai pedoman org yg beriman
spam,Hi! Ayo coba Grab untuk pemesanan taxi yang cepat dan aman. Klik: https://invite.grab.co/37aa4d,hi ayo coba grab pemesanan taxi cepat aman klik httpsinvitegrabcoaad
spam,"Anda akan membeli Paket Gampang Internetan Rp.1250 utk Chatting Sepuasnya (BBM, WhatsApp dan Line)/1 hari.Jika setuju balas FLASH<spasi>YA kirim ke 3636 utk melanjutkan.Tunggu SMS konfirmasi sblm pemakaian.Info detail tariff lihat di Tsel.me/internet ",membeli paket gampang internetan rp utk chatting sepuasnya bbm whatsapp line harijika setuju balas flashspasiya kirim utk melanjutkantunggu sms konfirmasi sblm pemakaianinfo detail tariff lihat tselmeinternet
spam,INFO RESMI SELAMAT!!! NO simCARD Anda Men_dptkn Uang Tunai Rp 45jt. Dr PT.INDOSAT PIN(TBL48VG) info Hub: 085694961118 A/u klik www.indosat-info2013.jimdo.com,info resmi selamat no simcard mendptkn uang tunai rp jt dr ptindosat pintblvg info hub au klik wwwindosatinfojimdocom
ham,"Murah nuy 30seorang, drpd naik angkot bisa 15rebu, belum ngetem, macet, gt",murah nuy drpd angkot rebu ngetem macet gt
ham,"Tp aku gak tertarik gt sih diperusahaan itu, org it nya baru satu ",tp gak tertarik gt sih diperusahaan org it nya
spam,"INDOVISON PROMO: hanya 299 rbu, nikmati 2 bln berlangganan, GRATIS biaya pasang+bonus cinema 3 (3bln). hub : 087738718255, 08555796717 PIN BB 32F1C805",indovison promo rbu nikmati bln berlangganan gratis biaya pasangbonus cinema bln hub pin bb fc
ham,Wihh nyimper kopernya dmn? Motor gigi kan?,wihh nyimper kopernya dmn motor gigi
ham,Besok dwm jadi ya praktikum weka. Bawa laptop.,besok dwm ya praktikum weka bawa laptop
ham,Gais aku sudah brgkt. Mau matiin hp,gais brgkt matiin hp
spam,Mau BONUS KEREN dari Indosat ooredoo? Ketik *345# dari HP kamu sekarang juga..!!,bonus keren indosat ooredoo ketik hp
ham,Pagi bu saya dengan nama1 dari Bebek Komar ...sangat bisa bu untuk pesanan besok bu...menu yang di pesan apa ya bu...diantar ke mana ya...nuhun,pagi bu nama bebek komar bu pesanan besok bumenu pesan ya budiantar yanuhun
spam,Surat Keputusan Dri Tri Care No.XV/2015 Pin Pemenang 477BFG7S Mdptkan Hadiah HONDA JAZZ HUB:02150227999 Info Pin klik: www.tricareindonesia.com,surat keputusan dri tri care noxv pin pemenang bfgs mdptkan hadiah honda jazz hub info pin klik wwwtricareindonesiacom
spam,SELAMAT!! Anda M-dapat hadiah Satu unit mobil alphard dr TELKOMSEL info hub;0016282336033777/kunjungi website kami di http://telkomselundian2013.jimdo.com,selamat mdapat hadiah unit mobil alphard dr telkomsel info hubkunjungi website httptelkomselundianjimdocom
ham,Memperbaiki bug2 karna ganti db bbrp. Lg enak nonton td ditelfon 😂,memperbaiki bug karna ganti db bbrp lg enak nonton td ditelfon 😂
ham,"Selamat sore Pak, besok kami bisa ke kantor jam brp Pak?",selamat sore besok kantor jam brp
spam,"Ada iRing dgn tarif Rp. 0,1/7hr (perpanjangan Rp. 3190/7hr) dari hits Armada - Pencuri Hati. Tekan *808*3*1*4*1# lalu OK/Call. Info: 100&111",iring dgn tarif rp hr perpanjangan rp hr hits armada pencuri hati tekan okcall info
spam,"Dapatkan Segera TIKET Murah & Promo DiTRAVEL Kmi,Untuk Penerbangan Domestik & Internasional ONLINE BOOKING 24 Jam Anda Berminat Hub:085318303276",dapatkan tiket murah promo ditravel kmiuntuk penerbangan domestik internasional online booking jam berminat hub
spam,Pelanggan Yth. TRI CARE No.XV/2015 PIN_PEMENANG ANDA 8JF2177. Mendapatkan Hadiah 1 Unit Mobil Toyota Yaris. Info klik http://tri-3.webnode.com/ UNTUK MENCOCOKKAN PIN PEMENANG ANDA,pelanggan yth tri care noxv pinpemenang jf hadiah unit mobil toyota yaris info klik httptriwebnodecom mencocokkan pin pemenang
ham,Gaaais penamaannya kyk nama1 nih biar rapih,gaaais penamaannya kyk nama nih biar rapih
ham,Jumlah poin Anda s.d tgl 16/08/16 : 18 poin. Anda termasuk dalam kategori RED. Masa berlaku poin s.d 31 Des 2016,poin sd tgl poin kategori red berlaku poin sd des
spam,selamat nomor 3Care anda terpilih mendptkan Hadiah Honda Jazz RS dr program Undian 3care PIN:792RW1F7 Info klik: www.tricare2016.jimdo.com Nih BANK BRI No Rekening:  313.0100.5936.535 Atas Nama: Bayu Alamsyah,selamat nomor care terpilih mendptkan hadiah honda jazz rs dr program undian care pinrwf info klik wwwtricarejimdocom nih bank bri no rekening nama bayu alamsyah
spam,"Mah,esian plz kna no 085741670427 nu 20 rbu ayena",mahesian plz kna no nu rbu ayena
ham,Oh oke de. kalau selanjutnya isi deposit transfer kmn?,oh oke de isi deposit transfer kmn
spam,"Transfer ke Mandiri aja, a/n Resti Amanda norek 9000007701999",transfer mandiri aja an resti amanda norek
ham,"penuh nama1 , si nama1  juga nyari, udh penuh..",penuh nama si nama nyari udh penuh
spam,"LINE Lets Get Rich semakin seru, tambah koinnya dari pulsamu, mudah banget caranya di google play",line lets get rich seru koinnya pulsamu mudah banget google play
spam,Manfaatkan segera creditCard anda utk apply pinjaman 20-250jt ada cashback berminat hub: Bintang 021-27450166.tks,manfaatkan creditcard utk apply pinjaman jt cashback berminat hub bintang tks
spam,"Yuk tetap gunakan Flash Volume Ultima utk update informasi Anda, kuota 60MB/7hr mulai Rp7rb di *100*431#. Tarif&lokasi cek di tsel.me/FL",yuk flash volume ultima utk update informasi kuota mbhr rprb tariflokasi cek tselmefl
spam,Nikmati nelpon dan SMS UNLIMITED ke sesama Indosat Ooredoo internetan sepuasnya 3 hari dengan paket Ramadhan Unlimited. ketik *123*88#,nikmati nelpon sms unlimited indosat ooredoo internetan sepuasnya paket ramadhan unlimited ketik
spam,Pelanggan Yth SimCARD Anda M-dptkan Cek Tuanai Rp:27jt Dari PT.TRICARE INDONESIA Pin Anda HDR7JN7 U/Cek Pin Kunjungi www.programundiantricare-2015.blogspot.co.id,pelanggan yth simcard mdptkan cek tuanai rpjt pttricare indonesia pin hdrjn ucek pin kunjungi wwwprogramundiantricareblogspotcoid
spam,Keputusan resmi 3care selamat No.anda Terpilih M'dpt Tabungan Rp.35jt Pin:M902CX8J info kelik www.programisiulang3care.tk ,keputusan resmi care selamat noanda terpilih mdpt tabungan rpjt pinmcxj info kelik wwwprogramisiulangcaretk
spam,"Nikmati diskon 25% tarif SLI 008 ke SEMUA NEGARA mulai pukul 00.00 sd 06.00 WIB, sd 31Agustus 13. Info lengkap ketik *122*5*4# atau www.indosat.com/iddpromo",nikmati diskon tarif sli negara sd wib sd agustus info lengkap ketik wwwindosatcomiddpromo
ham,"nama1, note nama1 yang Dinamic ada di emil. Kembaliin ke nama1 atau gmana?",nama note nama dinamic emil kembaliin nama gmana
ham,"nama1 bisa lembar yg kamrin bisa minta ke pak anto. Tp ibu minta yg di bab 2 harus diparafrase kalimatnya, jgn copy paste semua.",nama lembar yg kamrin anto tp yg bab diparafrase kalimatnya jgn copy paste
ham,"Iya, semua kamera kecuali kamera lia aku taro di situ semua",iya kamera kecuali kamera lia taro situ
ham,Tp baru tau teori doang sih...... Da blm ngerasain yg rumit2,tp tau teori doang sih da blm ngerasain yg rumit
spam,"SLMT!-No Anda M-dpt 1-unit Mobil all New AVANZA,Dari TELKOMSELpoin PIN_pmenan anda b89c7h9)U/info Lengkap kunjungi: www.telkomselpoin-777.pusku.com",slmtno mdpt unit mobil all new avanzadari telkomselpoin pinpmenan bchuinfo lengkap kunjungi wwwtelkomselpoinpuskucom
ham,"persiapkan dengan dokumen draftnya diambil di ruang saya, slide presentasi tuk pengujian..",persiapkan dokumen draftnya diambil ruang slide presentasi tuk pengujian
spam,"Nomor kamu tidak memiliki Paket NetMax. Dapatkan Paket NetMax 5.5GB dan 7GB melalui hape *123#, aplikasi BimaTri, atau website tri.co.id.",nomor memiliki paket netmax dapatkan paket netmax gb gb hape aplikasi bimatri website tricoid
ham,Ini ini udh disini mau apa aku gorengin,udh gorengin
ham,Ada yg tau ruangan pak daya yg di fpmipa b?,yg tau ruangan daya yg fpmipa b
ham,Ini kalo kita lg beneran ngumpul pasti lg mewek berjamaah,kalo lg beneran ngumpul lg mewek berjamaah
spam,"Ayo kawal pemanfaatan subsidi BBM & Kompensasi bagi yang berhak! Pengaduan, ketik BBM (spasi) isi pesan. Kirim 1708",ayo kawal pemanfaatan subsidi bbm kompensasi berhak pengaduan ketik bbm spasi isi pesan kirim
ham,Soalnya ini fitutnya lebih lengkap.,fitutnya lengkap
spam,"Kirim ke MANDIRI aja, a/n ARYA. rek: 131-000-7252-937. klo sudah kabarin ya!",kirim mandiri aja an arya rek klo kabarin ya
ham,"Soalnya aku pernah ujug2 dtng, terus bapak nya bilang kalau mau bimbingan bls wa ya, biar saya bisa estimasi waktu, gitu",ujug dtng nya bilang bimbingan bls wa ya biar estimasi gitu
spam,"Plg yth,Mohon memberikan nilai kepuasan pengalaman layanan Telkomsel ketik 1 utk bhs Indonesia & Type 2 for English send to 1166(FREE) (for int'l charged)",plg ythmohon nilai kepuasan pengalaman layanan telkomsel ketik utk bhs indonesia type for english send to free for intl charged
ham,nama1 kemaren kamera dan handycam waktu msceis pake kamera siapa aj?,nama kemaren kamera handycam msceis pake kamera aj
ham,"Bentar lg ke gik, buru2 ga? Kalo buru2 nitip yg ngontrak ipc aj",bentar lg gik buru ga kalo buru nitip yg ngontrak ipc aj
ham,Paket tadi sore mendadak habis.,paket sore mendadak habis
ham,"yaudah, minta data dummy untuk diagnosa_pasien dong",yaudah data dummy diagnosapasien
spam,"Anda akan menerima setting ponsel, agar ponsel Anda dapat mengakses internet dan berkirim foto/MMS. Jika Anda setuju balas pesan ini (gratis) dengan ketik Y.",menerima setting ponsel ponsel mengakses internet berkirim fotomms setuju balas pesan gratis ketik y
ham,Iya put alat masak makan mah aku usahain ada,iya put alat masak makan mah usahain
ham,"Wkwk tumben kar biasanya masing2 punya sendiri kar, sampe yg sewarna ada 3",wkwk tumben kar kar sampe yg sewarna
ham,emang berbayar nama1 .,emang berbayar nama
ham,Padahal mau kesana tapi kyknya nama1 belum balik,kesana kyknya nama
ham,"Isi saldo nya bisa di grapari, indomaret, ato di tf dari bca",isi saldo nya grapari indomaret ato tf bca
spam,Isi ulang Pulsa Rp.5000 regular oleh HD COM 4 SUKSES pada 09/02 12:34.Ref:763179369.GRATIS PULSA sd 250rb hg 7Hr 7Mlm.Ktk:GRATIS krm ke 123,isi ulang pulsa rp regular hd com sukses refgratis pulsa sd rb hg hr mlmktkgratis krm
ham,oke. bentar aku solat dulu,oke bentar solat
ham,"Ada yg nikah muda, ada yg gagal nikah, ada yg pacaran lama eh putus tapi alesannya karna terlalu sayang jd gak mau nyakitin (pret), ada yg jagain jodoh org, ada yg ah banyak lah wkwk",yg nikah muda yg gagal nikah yg pacaran eh putus alesannya karna sayang jd gak nyakitin pret yg jagain jodoh org yg ah wkwk
spam,Nikmati Double Internetan di jaringan Data terkuat 3GB dan 3GB (4G) dan Tlp&SMS SEPUASNYA dgn pkt Freedom Combo. Daftar *123# atau http://mycare.indosatooredoo.com,nikmati double internetan jaringan data terkuat gb gb g tlpsms sepuasnya dgn pkt freedom combo daftar httpmycareindosatooredoocom
ham,Iya liat mock up nya maksudnya,iya liat mock up nya maksudnya
ham,Kok antara optimis dan ngga yah 😟,optimis ngga yah 😟
spam,Pesan Resmi M-KIOS Sim Card Anda Menang Hadiah ke4 Cek 100jt Dari Promo M-KIOS PIN:M7H7R47 hub:Ir.H.SURIANTO 0823 8777 5019 klik: www.kjtn-mkiosjkt.blogspot.com,pesan resmi mkios sim card menang hadiah cek jt promo mkios pinmhr hubirhsurianto klik wwwkjtnmkiosjktblogspotcom
spam,ini rekeningnya bank bri.no/rek.018801.006474.53.2.a/n:IR MAYANI,rekeningnya bank brinorekanir mayani
spam,"Jangan sampai kalah Bro, games mu bisa terbantu dengan menambah koinmu, beli aja pakai pulsa, cek caranya di http://tsel.me/jajanonline",kalah bro games mu terbantu menambah koinmu beli aja pakai pulsa cek httptselmejajanonline
spam,SELAMAT Anda sebagai pemenang promo UNDIAN POP-MIE GETLUCKY men-dptkan 1unit MOBIL NISSAN JUKE pin anda:b89c7h9 U/INFO Klik:www.hadiah-pop-mie-2013.webs.com,selamat pemenang promo undian popmie getlucky mendptkan unit mobil nissan juke pin andabch uinfo klikwwwhadiahpopmiewebscom
spam,"Slmt simCARD anda 08562XXXXXX mdpat cek tunai Rp.49jt PIN (RWD2749) info CS,085691371116 atau kunjungi www.indosat-id.jimdo.com",slmt simcard xxxxxx mdpat cek tunai rpjt pin rwd info cs kunjungi wwwindosatidjimdocom
spam,Selamat Anda mendapatkan voucher Zalora Rp100rb. Masukkan kode voucher TSU59 saat transaksi di www.zalora.co.id/simPATI. Mau voucher lain? Hub *999*1#,selamat voucher zalora rprb masukkan kode voucher tsu transaksi wwwzaloracoidsimpati voucher hub
