Kategori,Pesan,Cleaned
spam,Mainkan terus gamesmu & beli sebanyak2nya apps/in-apps di Google Play Store,mainkan gamesmu beli sebanyaknya appsinapps google play store
ham,Masih yang dekat sungai dulu kok diil 😁,sungai diil 😁
spam,YTH kpd bpk/ibu sy Eka Novitasari kariyawan 3care sudah M-hub anda tdk tersambung dgn hormat hal ini kami sampaikan melalui sms singkat dr layanan kami bahwa selamat no anda M-dptkan hadiah 1 unit mobil Toyota Avanza dgn PIN:47V27 dr undian rejeki 3care periode utama 2014.u/info lebih lanjut kunjungi www.rejekiundian3care.jimdo.com,yth kpd bpkibu sy eka novitasari kariyawan care mhub tdk tersambung dgn hormat sms singkat dr layanan selamat no mdptkan hadiah unit mobil toyota avanza dgn pinv dr undian rejeki care periode utama uinfo kunjungi wwwrejekiundiancarejimdocom
ham,Oh udah yah haha aku bingung jd gimana udh ketinggalan banyak chat,oh udah yah haha bingung jd gimana udh ketinggalan chat
ham,"Selain itu saya punya ide untuk menggabungkan beberapa device HP sebagai sumber sensor, misal untuk deteksi longsor atau gempa ini terkait trend sekarang: iOT (internet of thing), silahkan bagi yg tertarik :)",ide menggabungkan device hp sumber sensor deteksi longsor gempa terkait trend iot internet of thing silahkan yg tertarik
spam,"Ini, Rekeningnya. Bank BNI No.rek.0277285682 A/n.WAHYUDI ALAMSYAH sms klo sudah dikirim",rekeningnya bank bni norek anwahyudi alamsyah sms klo dikirim
ham,Pilihannya hemat 2 jt atau lulus oct kan nanggung,pilihannya hemat jt lulus oct nanggung
spam,Permintaan Anda akan segera kami proses untuk keyword REG GITA dari layanan PT. Hypermind,permintaan proses keyword reg gita layanan pt hypermind
ham,Mau yang apa? Sunday atau apa? Terus rasa slainya apa?,sunday slainya
spam,"GRATIS Internetan hg 1000 MB, Nelpon 1000 Menit & 1000 SMS ke Sesama Indosat dg IsiUlang mulai 10Rb.Utk daftar ketik GRATIS kirim ke 123 (GRATIS) lalu isi Ulang",gratis internetan hg mb nelpon menit sms indosat dg isiulang rbutk daftar ketik gratis kirim gratis isi ulang
spam,Terima kasih telah melakukan pengisian di counter kami WAR PUL CELL. Info: kami Melayani pembayaran tagihan PLN,terima kasih pengisian counter war pul cell info melayani pembayaran tagihan pln
ham,"untuk dwm soal klasifikasi, algoritma yang menjadi dasar adalah random forest dengan akurasi model kira2 0.8. Setelah menggunakan data test (data yg saya berikan kemarin di UAS untuk diprediksi), akurasi yg didapat adalah 0.75. Jika mhs mendapat akurasi 0.75 dia akan mendapat nilai maksimal (20point). Akurasi tertinggi 0.77 diperoleh oleh nama1",dwm klasifikasi algoritma dasar random forest akurasi model data test data yg kemarin uas diprediksi akurasi yg mhs akurasi nilai maksimal point akurasi tertinggi diperoleh nama
ham,"Bisa kurang dari 15rb ga Pak, sebelumnya kita pernah acara sama bebek komar sekitar iti 13.5rb awal tahun 2015",rb ga acara bebek komar iti rb
spam,"Tolong uangnya ditransfer saja ke Bank xxx A/n. xxx 0231327XXX, kalau sudah ditransfer SMS saja, terima kasih",tolong uangnya ditransfer bank xxx an xxx xxx ditransfer sms terima kasih
spam,"Yank, isikan dl pulsa di no as ini 085323048677 nanti gw gantiin.Penting bget nih krn barusan bos gw nelpon gw tgguin yach…",yank isikan dl pulsa no as gw gantiinpenting bget nih krn barusan bos gw nelpon gw tgguin yach…
spam,Nikmati EKSTRA PULSA 50% dgn isi ulang min. 100rb HANYA di aplikasi MyTelkomsel menggunakan Kartu Kredit VISA! Download di http://tsel.me/1 Promo s/d 11 Agst 16,nikmati ekstra pulsa dgn isi ulang min rb aplikasi mytelkomsel kartu kredit visa download httptselme promo sd agst
spam,"PROMO: Beli paket Flash mulai 1GB di MY TELKOMSEL APP dpt EXTRA kuota 2GB 4G LTE dan EXTRA nelpon hingga 100mnt/1hr. Buruan, cek  di tsel.me/mytsel1 S&K",promo beli paket flash gb my telkomsel app dpt extra kuota gb g lte extra nelpon mnthr buruan cek tselmemytsel sk
spam,Anda akan berlangganan paket Rp. 10000 utk 150 MB 2G/3G + 250 MB 3G/90hari. Jika setuju balas FLASH<spasi>YA kirim ke 3636 utk melanjutkan. Paket diperpanjang pada akhir masa aktif dengan tarif sesuai lokasi Anda. Tunggu SMS konfirmasi sblm pemakaian. Info zona dan detail tarif lihat di Tsel.me/internet,berlangganan paket rp utk mb gg mb ghari setuju balas flashspasiya kirim utk melanjutkan paket diperpanjang aktif tarif sesuai lokasi tunggu sms konfirmasi sblm pemakaian info zona detail tarif lihat tselmeinternet
spam,Nikmati Disc.40% utk Dominos Pizza Premium BIG PARTY WEEKEND.Harga Mulai Rp.48rb.Berlaku dine in/take away s/d 8 May'16.Kunjungi store terdekat/hubungi 1500366,nikmati disc utk dominos pizza premium big party weekendharga rprbberlaku dine intake away sd maykunjungi store terdekathubungi
spam,"Bapak tukokno pulsa AS ndisek 20ribu iki nmrku anyar 085316079211 cepet saiki tak enteni,penteng bpk ada msalah dikantor polisi,jangan dulu sms/tlp",tukokno pulsa as ndisek ribu iki nmrku anyar cepet saiki entenipenteng bpk msalah dikantor polisijangan smstlp
ham,Guys ada yg bermotor mau ngampus gak? Temenin ambil foto laaah (unbearable),guys yg bermotor ngampus gak temenin ambil foto laaah unbearable
ham,"Engga teh aku udh siap, mau brgkt ini. Aku td line teteh",engga teh udh brgkt td line teteh
ham,"cari yang seken, murah meriah kualiatasnya masih bagus kok",cari seken murah meriah kualiatasnya bagus
ham,Maafin ya guys gak hari ini huhuhu,maafin ya guys gak huhuhu
ham,Teh jadi mau ketemuan ,teh ketemuan
ham,"gatau tadi bapa nya keburu jumatan , pokonya suruh ngumpul dlu gt katanya ",gatau bapa nya keburu jumatan pokonya suruh ngumpul dlu gt
ham,Gpp kali beda beda sep,gpp kali beda beda sep
ham,Oiya ya nama1  ih knapa bsa begitu?sayang bgt tabungannya :(,oiya ya nama ih knapa bsa begitusayang bgt tabungannya
spam,"Mau Cepat GIFT Paket/Extra Kuota Internet & ga mau ribet isi ulang Pulsa? Download aja aplikasi myCare, smuanya jadi mudah. Install di http://bit.ly/mycarepLy",cepat gift paketextra kuota internet ga ribet isi ulang pulsa download aja aplikasi mycare smuanya mudah install httpbitlymycareply
spam,"Seru banget main 8 Ball Pool, pakai pulsa bisa banget loh Bro untuk beli koin games lainnya, cek caranya di http://tsel.me/jajanonline",seru banget main ball pool pakai pulsa banget loh bro beli koin games cek httptselmejajanonline
spam,"RESMI dari indosat NO anda 0815XXXXXXX terpilih sebagai pemenang poin plus-plus PIN Pemenang Anda (b89c7h9) u/info klik www.semarak-poinplusplus-2013.webs.com"" (sms ini dikirim dari no 085798428715)",resmi indosat no xxxxxxx terpilih pemenang poin plusplus pin pemenang bch uinfo klik wwwsemarakpoinpluspluswebscom sms dikirim no
spam,"Berkat isi ulang pulsa No anda T,pilih sbg pemenang Cek tunai Rp.75jt dri PT.M-KIOS PIN:(5N939F7) U/INFO KLIK www.pt-mkios15.blogspot.com",berkat isi ulang pulsa no tpilih sbg pemenang cek tunai rpjt dri ptmkios pinnf uinfo klik wwwptmkiosblogspotcom
spam,"Hallo Bro, beli koin games pakai pulsamu yuk, mudah banget loh sob, cek http://tsel.me/jajanonline",hallo bro beli koin games pakai pulsamu yuk mudah banget loh sob cek httptselmejajanonline
spam,"Tambahan THR dr MatahariMall. Kode THR6 utk Diskon 6% Elektronik, kode THR15 utk Diskon 15% Lifestyle, kode THR25 utk Diskon 25% Fashion. http://mthr.ml/TSELTHR",tambahan thr dr mataharimall kode thr utk diskon elektronik kode thr utk diskon lifestyle kode thr utk diskon fashion httpmthrmltselthr
ham,Cape sih tp da susah euy kalo udah pikiran gtu teh,cape sih tp da susah euy kalo udah pikiran gtu teh
spam,"Bisa Internetan 1,5GB CUMA dengan 20rb, paket berlaku 90 hari. MAU?? Ketik YA ke 919. Penawaran berlaku s/d 8 Januari 2016",internetan gb rb paket berlaku ketik ya penawaran berlaku sd januari
spam,"Paket Internet spesial buat kamu. Internetan selama seminggu dgn kuota 1,5GB Cuma Rp10rb! Ayo segera Ketik KEBUT kirim ke 919 sd 29 Juli 2015. Jgn lupa ya",paket internet spesial internetan seminggu dgn kuota gb rprb ayo ketik kebut kirim sd juli jgn lupa ya
spam,"Terima kasih telah menjadi Sahabat IndosatOoredoo. Kenalan tanpa batas dan BONUS GRATIS NELPON 60 menit, hub *955*1# lalu YA/OK",terima kasih sahabat indosatooredoo kenalan batas bonus gratis nelpon menit hub yaok
ham,"Terus kalau ada yang nanya, kita masuknya suka pagi sampai siang kadang juga siang sampai sore. Gimana dari sananha.",nanya masuknya suka pagi siang kadang siang sore gimana sananha
ham,"Malem aja lah, jam 5 nanggung banget mw maghrib haha",malem aja jam nanggung banget mw maghrib haha
spam,Pembelian Dave's Single Burger Gratis Small Fries & Minum. Periode 5-11 September 2016. Tukarkan SMS ini di Wendy's terdekat! Penawaran terbatas.Promo *606#,pembelian daves single burger gratis small fries minum periode september tukarkan sms wendys terdekat penawaran terbataspromo
ham,"Eh di kosan nama1 maksudnya, buat temen nama1 , buat september",eh kosan nama maksudnya temen nama september
ham,Ada belakang warkop deket indomaret gerum 500/bulan,warkop deket indomaret gerum
ham,Gaaais dlm semenit aja aku jd nasabah btpn wkwk,gaaais dlm semenit aja jd nasabah btpn wkwk
spam,"TOP100 CELLULER Discound 25% BB DACOTA RP. 3,9 jt, BB ONYX3 Rp 3 jt, BB GEMINI Rp  1 jt, Laptop\KAMERA, iphone ; dll, info kunjungi www.top100-celluler.com pin ; BB, 2A95596A",top celluler discound bb dacota rp jt bb onyx rp jt bb gemini rp jt laptopkamera iphone dll info kunjungi wwwtopcellulercom pin bb aa
spam,km dari BANK BRI Sdh tlp tdk bs jd km SMS No.PIN Pemenang anda KG65H8K9 M-dpt HADIAH dari Untung Bliung BritAma Info klik www.HadiahkejutangBri.blogspot.com,km bank bri sdh tlp tdk bs jd km sms nopin pemenang kghk mdpt hadiah untung bliung britama info klik wwwhadiahkejutangbriblogspotcom
ham,Jadi kitanya harus cari kesibukan jg ya? Biar ga mikirin cowo melulu,kitanya cari kesibukan jg ya biar ga mikirin cowo melulu
ham,bisa turun juga. Mencegah ikut remedial tapi tanpa persiapan dan asal-asalan menjawab.,turun mencegah remedial persiapan asalasalan
ham,"Kalem, saya diantapani lagi ujian sama intan. Hher",kalem diantapani ujian intan hher
spam,"Mainkan terus games mu sekarang, dan beli koinnya pakai pulsamu, cek caranya di http://tsel.me/jajanonline",mainkan games mu beli koinnya pakai pulsamu cek httptselmejajanonline
ham,No bri atas nama kamu mana,no bri nama
ham,"Kan bapaknya ngomong2 ya, trs ditanya siapa itu, aku blg lg rame ma sibuk dikampus nanti yaa",bapaknya ngomong ya trs blg lg rame ma sibuk dikampus yaa
spam,Ayo dukung pelestarian alam Indonesia bersama Indosat Ooredoo dan WWF-Indonesia dg berdonasi melalui *123*50# dari nomor Indosat Ooredoo.,ayo dukung pelestarian alam indonesia indosat ooredoo wwfindonesia dg berdonasi nomor indosat ooredoo
spam,CAHAYA TRAVEL TIKET Murah & promo untuk penerbangan Domestic & Internasional ONLINE BOOKING 24 jam hub 081310537888 kelik www.cahayatourtravel.com,cahaya travel tiket murah promo penerbangan domestic internasional online booking jam hub kelik wwwcahayatourtravelcom
spam,Surat keputusan dari Tri Care INDONESIA No.XV/2016 Pin_Pemenang ANDA:67ytg44 mendapatkan HADIAH CEK TUNAI Rp.45juta U/INFO klik: www.info-undian3.webnode.com,surat keputusan tri care indonesia noxv pinpemenang andaytg hadiah cek tunai rpjuta uinfo klik wwwinfoundianwebnodecom
spam,"RUMAH&TANAH yg mau di jual,sy IBU AYU sdh SURVEI dan berminat u/membeli Mslh hrg Mhn hub suami saya 085282157222 Dr.HJ.SOPIAN",rumahtanah yg jualsy ayu sdh survei berminat umembeli mslh hrg mhn hub suami drhjsopian
ham,Engga tau sep ntr di kosan aku cek sepertinya tidak ada semalam aku liat,engga tau sep ntr kosan cek semalam liat
spam,Slmt No Anda mendptkan Hadiah 1 unit MOBIL HONDA jazz dr promo TRI CARE 2016 dgn PIN PEMENANG:454647LM lnfo Klik:www.kejutanbimatri.blogspot.com,slmt no mendptkan hadiah unit mobil honda jazz dr promo tri care dgn pin pemenanglm lnfo klikwwwkejutanbimatriblogspotcom
ham,"Jadi males banget PLA, asa ga pernah beres. Wkwk. Padahal dari pa rawosi ga bermasalah.",males banget pla asa ga beres wkwk pa rawosi ga bermasalah
spam,"TOKO NIAGA-CELL Disc 45% Khusus PROMO :-  Blackberry-  NOKIA-  SAMSUNG-  IPHONE dll, Info Hub/sms ke : 082-33333-783 Buka  Website Kami : www.niaga-cell.blogspot.com",toko niagacell disc khusus promo blackberry nokia samsung iphone dll info hubsms buka website wwwniagacellblogspotcom
ham,"boleh install sendiri, nanti juga saya bawa installernya.",install bawa installernya
spam,"Selamat,Anda M-dptkan Hadiah 1 Unit Mobil HONDA JAZZ & UANG TUNAI 35JT Rs Dr PT.TriCare PIN Pemenang Anda;477bfg7s. U/info klik: www.tricareindonesia.com",selamatanda mdptkan hadiah unit mobil honda jazz uang tunai jt rs dr pttricare pin pemenang andabfgs uinfo klik wwwtricareindonesiacom
ham,Kalau agus atau sept blm bisa menjamin ada kalau sekarang ada yang kosong,agus sept blm menjamin kosong
spam,"PESAN RESMI dri Tri Care,Selamat anda m-dptkan hadiah CEK TUNAI Sebesar Rp.45jt No:Pin undian 94AD653, U/Info kunjungi:www.pusat-bimatricare.jimdo.com",pesan resmi dri tri careselamat mdptkan hadiah cek tunai rpjt nopin undian ad uinfo kunjungiwwwpusatbimatricarejimdocom
spam,"Selamat,No SimCard Anda Resmi M-dptkan HADIAH 1 Unit HONDA JAZZ Dari, Tri 3Care PIN PEMENANG Anda 25ZT67KM U/Info Cek Pin Klik: www.infohadiahtricare.ml",selamatno simcard resmi mdptkan hadiah unit honda jazz tri care pin pemenang ztkm uinfo cek pin klik wwwinfohadiahtricareml
ham,nama1 seharusnya cuman nambah table daftar_ulang_ird + kalau ada masternya. Yg lain kita samain aja ya pake yg aku data_pasien (2).sql,nama cuman nambah table daftarulangird masternya yg samain aja ya pake yg datapasien sql
spam,"PROMO BLACKBERRY BB DAKOTA 2,9jt BB Torch 2jt BB Davis 1,5jt BB Onyx 1,4jt BB Gemini 950rb Berminat hub : 085715186696 Promo terbatas*",promo blackberry bb dakota jt bb torch jt bb davis jt bb onyx jt bb gemini rb berminat hub promo terbatas
spam,PT.BNI (persero) Tbk. Rekening Anda Terpilih dapat Rp.27jt Dari Rejeki Bni Taplus. Kode Cek 02599875 Silahkan Klik  www.bnitaplus46.tk,ptbni persero tbk rekening terpilih rpjt rejeki bni taplus kode cek silahkan klik wwwbnitaplustk
ham,"aamiin, makasih semuanya moga cepat lulus juga",aamiin makasih moga cepat lulus
spam,"BELANJA ONLINE Promo Disc 50% BB Dakota 2,8jt BB Onyx3 2,2jt BB Z10 3,5jt DLL, Info/sms: 085775102735 PIN:BB.2A03F3F2 Atau Klik: www.jaya-olshop.blogspot.com",belanja online promo disc bb dakota jt bb onyx jt bb z jt dll infosms pinbbaff klik wwwjayaolshopblogspotcom
spam,"ISI PULSA lebih untung di MYVPLUS! selain dpt PULSA kamu bisa lsg dpt voucher diskon, dpt hadiah dan juga dpt point. Yuk klik : http://bit.ly/Myvplus",isi pulsa untung myvplus dpt pulsa lsg dpt voucher diskon dpt hadiah dpt point yuk klik httpbitlymyvplus
spam,PT.TRI No.V11-3/16 Slamat No.SimCARD Anda mraih CEK TUNAI Rp.35Jt Program ISI ULANG PULSA Pin:M902CX8J Info Klik: www.Bonus3tri.com,pttri nov slamat nosimcard mraih cek tunai rpjt program isi ulang pulsa pinmcxj info klik wwwbonustricom
ham,"Kalo pacaran jg harus cowonya yg lebih sayang guys, biar ga ngebatin",kalo pacaran jg cowonya yg sayang guys biar ga ngebatin
spam,"Segera dapatkan E-TIKET pswt hrga PROMO penerbangan Domestik & Internasional Reservasi tiket, mudah & Praktis, hub : 02136146799, 085312792222 www.Asia-travel.com",dapatkan etiket pswt hrga promo penerbangan domestik internasional reservasi tiket mudah praktis hub wwwasiatravelcom
ham,"Iya teh, soalnya kenapa selasa, bapa hari rabu mau berangkat.",iya teh selasa bapa rabu berangkat
ham,"Pemakaian internet kamu sdh mencapai batasFUP,kecepatan akan disesuaikan.Lebih EKSIS dgnINTERNETGaul Bulanan Cuma Rp29,900! http://net.axisworld.co.id info838",pemakaian internet sdh mencapai batasfupkecepatan disesuaikanlebih eksis dgninternetgaul bulanan rp httpnetaxisworldcoid info
ham,Untuk ayam bakar atau rica rica brp Pak?,ayam bakar rica rica brp
spam,Uangnya dikirim saja ke Rek. BANK BNI A/n. : Sdr ABDUL RAHMAN No. Rek. : 024-8721- 191 SMS saja kalau sudah dikirim. terima kasih,uangnya dikirim rek bank bni an sdr abdul rahman no rek sms dikirim terima kasih
ham,"Assalamualaikum akang teteh, jangan lupa ya hari ini ada carrier day jam 10:30, exhibition fpmipa b :) (love) Hayuu teh ditungguuu",assalamualaikum akang teteh lupa ya carrier day jam exhibition fpmipa b love hayuu teh ditungguuu
spam,"Tolong uangnya dikirim aja kesini BANK DANAMON a/n Farida hanum No rek. 0035-3918- 4014 SMS aja klo udah dikirim, Trims",tolong uangnya dikirim aja kesini bank danamon an farida hanum no rek sms aja klo udah dikirim trims
ham,"Paling seikhlasnya aja, yg mau nyumbang mangga, yg ngga, mangga gt",seikhlasnya aja yg nyumbang mangga yg ngga mangga gt
ham,Ada internet min alamatnya dmn?,internet min alamatnya dmn
ham,Makasih semuanyaaa mohon doanya yaaa,makasih semuanyaaa mohon doanya yaaa
ham,krn pulsa/limit tidak mencukupi. Dptkan informasi seputar kartu Tri di *123# atau via aplikasi BIMATRI,krn pulsalimit mencukupi dptkan informasi seputar kartu tri via aplikasi bimatri
ham,Ga ada birthday nya ? Wkwk,ga birthday nya wkwk
ham,Iyaaaa ayyuuuukk biar kamu bisa reunian dg org sana fir,iyaaaa ayyuuuukk biar reunian dg org fir
ham,Ceritanya biasa aja. Tp tetep bikin nangis,ceritanya aja tp tetep bikin nangis
spam,"Kartu 4G-LTE Anda telah aktif Dapatkan kuota tambahan sd 10GB&konten menarik dijaringan 4G, hub *123*46#. Info lokasi www.indosatooredoo.com/4G",kartu glte aktif dapatkan kuota tambahan sd gbkonten menarik dijaringan g hub info lokasi wwwindosatooredoocomg
ham,Bole duaduanya pen hardcover dulu. Tp kalau perusahaan udh minta boleh ttd dulu,bole duaduanya pen hardcover tp perusahaan udh ttd
spam,Selamat Anda mendapatkan voucher Lazada Rp100rb. Masukkan kode voucher TSt88 saat transaksi di www.lazada.co.id/simPATI. Mau voucher lain? Hub *999*1#,selamat voucher lazada rprb masukkan kode voucher tst transaksi wwwlazadacoidsimpati voucher hub
spam,"Tolong uangnya Di transfer sekarang aja ke bank BNI: 022-741-3681. A/n FRISKA ANANDA, sms kalau sudah di Transfer, trimksi... - See more at: http://metropolitan.inilah.com/read/detail/1777965/awas-modus-penipuan-sms-model-baru#sthash.DKwN8EaE.dpuf",tolong uangnya transfer aja bank bni an friska ananda sms transfer trimksi see more at httpmetropolitaninilahcomreaddetailawasmoduspenipuansmsmodelbarusthashdkwneaedpuf
ham,"Selamatkan diri kalian guys, karna ""nikah bareng"" hanyalah kebaperan sesaat #NaonAriDyah",selamatkan guys karna nikah bareng kebaperan naonaridyah
ham,tapi kuliahnya sekarang. SP sebenarnya tidak boleh untuk kuliah yg ada praktikum.,kuliahnya sp kuliah yg praktikum
spam,"Lelah byr min payment? Kami Solusinya, bantu secara LEGAL penutupan CC/KTA, dscn 50-75%. Hub.LoLyta 081316523061/087822962308 (WA). LEGAL",lelah byr min payment solusinya bantu legal penutupan cckta dscn hublolyta wa legal
ham,"Tapi masukin aja dulu, soalnya aku data pasien dari sana.",masukin aja data pasien
ham,"Gatau nuy, suruh tunggu aja cenah belom diinvite2 sama apapa aku mah",gatau nuy suruh tunggu aja cenah belom diinvite apapa mah
spam,"Maaf‟ Cuma ingatkan soal kontrakan kalau mau diteruskan/bayar, Harap ke Bpk Chandra, No: 082374910777, Soalnya sys dh kuasakan sepenuhnya. Maaf Cuma sms",maaf‟ ingatkan kontrakan diteruskanbayar harap bpk chandra no sys dh kuasakan sepenuhnya maaf sms
spam,"TOGEL SGP EDISI SENIN 10/06/2013 ANGKA JITU 40,76,65,53,89 di jamin tbs,stlh tbs anda harus krim plsa 100rb sebagai maharnya dkrm ke no; 082329969711 KI KARSO",togel sgp edisi senin angka jitu jamin tbsstlh tbs krim plsa rb maharnya dkrm no ki karso
ham,Besok saya ada rapat dinas.. Selasa aja ya...,besok rapat dinas selasa aja ya
ham,"semua udah masuk kok, cuma database sindo memang nggak real time.",udah masuk database sindo nggak real time
spam,"BONUS KUOTA 500MB (1hr)! Cukup isi ulang min. 5,000 hari ini! Ayo buruan isi pulsa sekarang juga. T514",bonus kuota mb hr isi ulang min ayo buruan isi pulsa t
ham,semoga cepat sembuh pak.,semoga cepat sembuh
spam,"solusi khusus pemegang kartu kredit, nikmati kredit tanpa angunan dari bank asing 5 - 99 jt = 1,79 % 100 - 150 jt = 1,5% hub: lukman 081586769255 021 - 94828857",solusi khusus pemegang kartu kredit nikmati kredit angunan bank asing jt jt hub lukman
ham,"Yang ada waktu luang besok pada futsal ya jam 4 di sampoerna, s Jangan ngaret",luang besok futsal ya jam sampoerna s ngaret
spam,"TOKO JEMBER Promo Discon 50% Keyboard Yahama: Dakota Rp. 2,8 jt, Onix3 Rp. 2,2 jt, Gemini Rp. 800 rb Info/SMS : 085234234117 PIN BB 295C6D02 www.jember-shop.blogspot.com",toko jember promo discon keyboard yahama dakota rp jt onix rp jt gemini rp rb infosms pin bb cd wwwjembershopblogspotcom
spam,"Krim ke BNI aja a/n Ayu Suryani no rek 0215891174, klo sudah dikirim kabarin ya!",krim bni aja an ayu suryani no rek klo dikirim kabarin ya
ham,"assalamualaikum pak, mohon maaf saya mau tanya pak, apakah remedial dwm harus hadir di tempat pak? apa bisa online? mohon maaf sebelumnya",assalamualaikum mohon maaf remedial dwm hadir online mohon maaf
ham,Keknya pernah liat undangannya di prodi,keknya liat undangannya prodi
ham,"itu masih pake data dummy, ntar gampang itu mh.",pake data dummy ntar gampang mh
spam,Saatnya pindah ke jaringan 4G TERCEPAT. Tukar kartu Anda di Gerai IndosatOoredoo Jl.Jend Soedirman-Purwokerto &dptkn bns Rp25rb (utk Nelp/SMS ke IndosatOoredoo),pindah jaringan g tercepat tukar kartu gerai indosatooredoo jljend soedirmanpurwokerto dptkn bns rprb utk nelpsms indosatooredoo
spam,"Ini bpk tolong belikan dulu pulsa 20ribu di no barunya bpk karna lagi ada masalah di kantor polisi dan jangan dulu tlp/sms nanti bpk yg tlp, penting.",bpk tolong belikan pulsa ribu no barunya bpk karna kantor polisi tlpsms bpk yg tlp
ham,"Yaudah gausah babakaran atuh, yg pake kompor aja. Lagian ribet kan nyalain arengnya",yaudah gausah babakaran atuh yg pake kompor aja ribet nyalain arengnya
ham,"saya beri opsi untuk nabung nilai, jadi kontraknya semester depan dan nilai dimasukkan ke semester tsb.",opsi nabung nilai kontraknya semester nilai dimasukkan semester tsb
ham,oke gais tp dsni udh redaan hujannya. dtggu ya,oke gais tp dsni udh redaan hujannya dtggu ya
ham,Bu mau mastiin ketemu di jica kan Bu?,bu mastiin ketemu jica bu
spam,Kirimi dulu pulsa 20ewu di no ini 085285485839 Mas Agus,kirimi pulsa ewu no mas agus
ham,Gaes gaes mau drakor gaes besok yawww,gaes gaes drakor gaes besok yawww
spam,Selamat anda terdftr diProg GRATIS Nelp 1000Mnt&1000SMS keISAT+Internet hg 1000MB CUMA dg IsiUlang mulai 10rb. isiUlang pulsamu&Nikmati bonusnya.Cekbns: *555*3#,selamat terdftr diprog gratis nelp mntsms keisatinternet hg mb dg isiulang rb isiulang pulsamunikmati bonusnyacekbns
spam,"PT. INDOFOOD tbk Menyampaikan bahwa anda terpilih pemenang HADIAH ke(3) dari promo POPMIE dengan PIN:2aiu87e, Utk/ info klik www.promoundian-popmie.jimdo.com",pt indofood tbk terpilih pemenang hadiah promo popmie pinaiue utk info klik wwwpromoundianpopmiejimdocom
spam,"Mengenai Rumah Bpk/Ibu yg mau di jual sdh di survey dan sy berminat,sy telpon tdk bisa tembus. masalah hrg hub suami sy. 0823-7390-1777 Dr.H.IRAWAN",rumah bpkibu yg jual sdh survey sy berminatsy telpon tdk tembus hrg hub suami sy drhirawan
spam,Ketik YA ke 919 s.d 14 Maret 2016. Cuma Rp59rb per-bln! Lgs dptkan 1+ 1GB(4G)+BONUS 10GB(4G) utk Internetan + Telp & SMS SEPUASNYA ke semua nomor,ketik ya sd maret rprb perbln lgs dptkan gbgbonus gbg utk internetan telp sms sepuasnya nomor
spam,"Kapan lg beli paket Flash mulai 1,3GB di MyTelkomsel dpt Extra PULSA Rp 50rb? Utk pembelian pertama sjk 25Aug - 25Sept. Cek detail paket di tsel.me/mytsel1",lg beli paket flash gb mytelkomsel dpt extra pulsa rp rb utk pembelian sjk aug sept cek detail paket tselmemytsel
ham,Kalo kata raditya dika tuh cara pandang org ttg cinta akan berubah setelah mengalami patah hati terhebat. Haha,kalo raditya dika tuh pandang org ttg cinta berubah mengalami patah hati terhebat haha
ham,Tapi daging kurban mentahnya udah ga ada :3,daging kurban mentahnya udah ga
spam,Selamat!!anda telah mendapat gratis 200 sms dari SMSGIFT dari no. 6285258952502. Info CS : 133/188,selamatanda gratis sms smsgift no info cs
ham,Haha ayook kita bully adi ndut sama sama 😃😃,haha ayook bully adi ndut 😃😃
spam,Surat keputusan resmi M-KIOS NOXV/04/2016 Menyatakan No.Anda resmi meraih hadiah ke-2 dri PT.M-KIOS Pin;M248K81 u/info klik ; www.hadiah-ptmkios547.blogspot.com,surat keputusan resmi mkios noxv noanda resmi meraih hadiah dri ptmkios pinmk uinfo klik wwwhadiahptmkiosblogspotcom
spam,Nasabah BRI yth. Anda dapat cek. 27.juta dari undian BRI Kode triplle cek anda (02599875) info hadiah klik www.bripusat2016.blogspot.com,nasabah bri yth cek juta undian bri kode triplle cek info hadiah klik wwwbripusatblogspotcom
spam,PESTA M-TRONIK!! Anda sebagai pelanggan Setia M-Tronik terpilih Pemenang HADIAH ke(3) PIN pemenang:2AIU87E U/info klik www.info-undianmtronik.jimdo.com,pesta mtronik pelanggan setia mtronik terpilih pemenang hadiah pin pemenangaiue uinfo klik wwwinfoundianmtronikjimdocom
spam,Bebas Pulsa! Ambil bonusmu di *600# (GRATIS). Dptkan gratis nelpon atau internetas atau promo lainnya sesuai hobimu!,bebas pulsa ambil bonusmu gratis dptkan gratis nelpon internetas promo sesuai hobimu
spam,"Maaf, hanya iklan penawaran pinjaman uang tunai tanpa jaminan KTA 5JT s.d 200JT dg KTP d KARTU KREDIT, Bunga Flat, simpan sms ni a/hub. 085717559229 ; 02199001886",maaf iklan penawaran pinjaman uang tunai jaminan kta jt sd jt dg ktp d kartu kredit bunga flat simpan sms ni ahub
spam,"Tolong belikan dulu mama pulsa 25rb di no AS baru mama 085245318024 soalnya teman mama kecelakaan, skrg kluarganya hrus dihubungi, nti mama ganti uangnya,penting",tolong belikan mama pulsa rb no as mama teman mama kecelakaan skrg kluarganya hrus dihubungi nti mama ganti uangnyapenting
spam,Pelanggan Yth: Selamat! No.SimCard anda 081571xxx resmi menang undian POIN plus-plus Edisi th2014 Pin anda:er56d7 U/info klik: www.hadiah-poin.blogspot.com,pelanggan yth selamat nosimcard xxx resmi menang undian poin plusplus edisi th pin andaerd uinfo klik wwwhadiahpoinblogspotcom
